NYSE:SWK,"Stanley Black & Decker, Inc.",Industrials,Capital Goods,Machinery,Industrial Machinery,118.1,10.9,17.8,0,0.022,"18,070.50","1000 Stanley Drive, New Britain, Connecticut, 06053, United States",6.7,8.5,8,8.1,6.5,6.7,6.5,6.5,4.4,6
NasdaqGS:SBUX,Starbucks Corporation,Consumer Discretionary,Consumer Services,"Hotels, Restaurants and Leisure",Restaurants,58.7,15.6,18.3,0,0.025,"79,138.20","2401 Utah Avenue South, Seattle, Washington, 98134, United States",3.2,2.5,3,2.3,1.9,2.1,1.9,1.9,1.6,1.6
NYSE:STT,State Street Corporation,Financials,Diversified Financials,Capital Markets,Asset Management and Custody Banks,72.9,0,12,2.2,0.026,"27,659.40","State Street Financial Center, One Lincoln Street, Boston, Massachusetts, 02111, United States",6.1,7.7,5.2,6.9,5,5.5,5,5,4.5,5.1
NasdaqGS:SRCL,"Stericycle, Inc.",Industrials,Commercial and Professional Services,Commercial Services and Supplies,Environmental and Facilities Services,53.1,10.5,27.5,0,0,"4,556.30","28161 North Keith Drive, Lake Forest, Illinois, 60045, United States",1.9,4.3,0.3,4.5,2.1,4.6,2.1,4.8,3.8,4.6
NYSE:SYK,Stryker Corporation,Health Care,Health Care Equipment and Services,Health Care Equipment and Supplies,Health Care Equipment,168.9,19.2,59.7,0,0.011,"63,182.00","2825 Airview Boulevard, Kalamazoo, Michigan, 49002, United States",2.8,7.6,2.7,6.9,4.4,6.3,4.4,5.5,1.3,5.1
NYSE:STI,"SunTrust Banks, Inc.",Financials,Banks,Banks,Regional Banks,62.8,0,10.8,1.8,0.032,"28,929.20","303 Peachtree Street, N.E., Atlanta, Georgia, 30308, United States",5.3,5.6,4.5,4.3,3.6,3.7,3.6,3.5,3.2,3.2
NasdaqGS:SIVB,SVB Financial Group,Financials,Banks,Banks,Regional Banks,281.8,0,21.6,3.2,0,"14,997.80","3003 Tasman Drive, Santa Clara, California, 95054, United States",13,19.3,9.2,11.3,7.3,7.8,7.3,6.8,5.3,5.4
NasdaqGS:SYMC,Symantec Corporation,Information Technology,Software and Services,Software,Systems Software,19.7,12.1,11.1,0,0.015,"12,225.70","350 Ellis Street, Mountain View, California, 94043, United States",1.5,1.6,1.5,1.8,-1.7,1.4,-1.7,1,0.8,2
NYSE:SYF,Synchrony Financial,Financials,Diversified Financials,Consumer Finance,Consumer Finance,31.4,0,10.7,1.9,0.027,"23,227.90","777 Long Ridge Road, Stamford, Connecticut, 06902, United States",2.9,3.7,2.4,2.9,2.7,3,2.7,2.8,2.8,2.5
NasdaqGS:SNPS,"Synopsys, Inc.",Information Technology,Software and Services,Software,Application Software,88.1,25.2,237.6,0,0,"13,090.60","690 East Middlefield Road, Mountain View, California, 94043, United States",0.4,3.9,0.9,3.5,1.7,3.2,1.7,3,1.6,2.7
NYSE:SYY,Sysco Corporation,Consumer Staples,Food and Staples Retailing,Food and Staples Retailing,Food Distributors,71.1,13.8,26.3,0,0.02,"37,021.00","1390 Enclave Parkway, Houston, Texas, 77077, United States",2.7,3.5,2.2,2.8,1.8,2.5,1.8,2,1.5,1.9
NasdaqGS:TROW,"T. Rowe Price Group, Inc.",Financials,Diversified Financials,Capital Markets,Asset Management and Custody Banks,100.1,9.8,15.4,4.5,0.028,"24,333.70","100 East Pratt Street, Baltimore, Maryland, 21202, United States",6.5,7.6,6,5.6,4.8,4.9,4.8,4.6,4.6,4.7
NasdaqGS:TTWO,"Take-Two Interactive Software, Inc.",Communication Services,Media and Entertainment,Entertainment,Interactive Home Entertainment,122.5,55.3,76.6,21.2,0,"13,938.30","110 West 44th Street, New York, New York, 10036, United States",1.6,5.4,1.6,3.8,0.2,1.7,0.2,1.2,-0.8,1.8
NYSE:TPR,"Tapestry, Inc.",Consumer Discretionary,Consumer Durables and Apparel,"Textiles, Apparel and Luxury Goods","Apparel, Accessories and Luxury Goods",42.5,10.8,30.8,0,0.032,"12,312.20","10 Hudson Yards, New York, New York, 10001, United States",1.4,2.8,1.1,2.5,1.8,2.2,1.8,1.9,2.1,1.9
NYSE:TGT,Target Corporation,Consumer Discretionary,Retailing,Multiline Retail,General Merchandise Stores,82,8.1,14.4,3.9,0.031,"43,171.30","1000 Nicollet Mall, Minneapolis, Minnesota, 55403, United States",5.7,5.5,4.8,4.3,5.5,5.4,5.5,5,4.3,3.7
NYSE:TEL,TE Connectivity Ltd.,Information Technology,Technology Hardware and Equipment,"Electronic Equipment, Instruments and Components",Electronic Manufacturing Services,77.6,9.7,20.6,12.4,0.023,"27,023.00","Rheinstrasse 20, Schaffhausen, Schaffhausen, 8200, Switzerland",3.8,5.8,3.4,5.3,5.6,4.4,5.6,4,4.2,4.2
NYSE:FTI,TechnipFMC plc,Energy,Energy,Energy Equipment and Services,Oil and Gas Equipment and Services,29.3,6,82,4.9,0.018,"13,183.30","One St. Pauls Churchyard, London, Greater London, EC4M 8AP, United Kingdom",0.4,1.5,0.2,1.4,3.2,0,3.2,0,4.4,0
NasdaqGS:TXN,Texas Instruments Incorporated,Information Technology,Semiconductors and Semiconductor Equipment,Semiconductors and Semiconductor Equipment,Semiconductors,98.3,12.9,22.6,17.8,0.031,"95,527.90","12500 TI Boulevard, Dallas, Texas, 75243, United States",4.3,6,3.6,4.6,3.5,3.5,3.5,3.1,2.6,3
NYSE:TXT,Textron Inc.,Industrials,Capital Goods,Aerospace and Defense,Aerospace and Defense,56.8,11.2,16.9,4.2,0.001,"14,097.30","40 Westminster Street, Providence, Rhode Island, 02903, United States",1.8,3.4,1.1,2.7,3.1,2.9,3.1,2.8,2,2.5
NYSE:AES,The AES Corporation,Utilities,Utilities,Independent Power and Renewable Electricity Producers,Independent Power Producers and Energy Traders,15,8.4,40.4,5.2,0.035,"9,912.00","4300 Wilson Boulevard, 11th Floor, Arlington, Virginia, 22203, United States",0.4,1.3,-0.8,1.2,0,1.3,0,1.2,1,1.3
NYSE:ALL,The Allstate Corporation,Financials,Insurance,Insurance,Property and Casualty Insurance,97.3,8,10.2,1.9,0.019,"33,695.30","2775 Sanders Road, Northbrook, Illinois, 60062, United States",9.5,8.9,8.4,6.9,4.7,5.8,4.7,5.2,6.3,5.6
NYSE:BK,The Bank of New York Mellon Corporation,Financials,Diversified Financials,Capital Markets,Asset Management and Custody Banks,47.4,0,11.1,3,0.024,"46,868.00","240 Greenwich Street, New York, New York, 10286, United States",4.2,4.2,3.7,3.9,3.2,3.4,3.2,3,2.2,2.5
NYSE:BA,The Boeing Company,Industrials,Capital Goods,Aerospace and Defense,Aerospace and Defense,356.3,15.9,22.4,0,0.019,"204,674.30","100 North Riverside, Chicago, Illinois, 60606, United States",15.9,15.8,13.4,10.8,7.6,9.1,7.6,9.1,7.4,8.5
NYSE:SCHW,The Charles Schwab Corporation,Financials,Diversified Financials,Capital Markets,Investment Banking and Brokerage,46.8,0,21.4,3,0.011,"63,270.30","211 Main Street, San Francisco, California, 94105, United States",2,2.8,1.6,1.8,1.3,1.5,1.3,1.2,1,1.1
NYSE:CLX,The Clorox Company,Consumer Staples,Household and Personal Products,Household Products,Household Products,152.6,16.8,24.4,0,0.025,"19,481.70","1221 Broadway, Oakland, California, 94612, United States",6.3,6.4,6.1,5.7,5,5.4,5,4.9,4.5,4.5
NYSE:KO,The Coca-Cola Company,Consumer Staples,"Food, Beverage and Tobacco",Beverages,Soft Drinks,46.3,18.9,91.3,134.9,0.034,"197,037.90","One Coca-Cola Plaza, Atlanta, Georgia, 30313, United States",0.5,2.1,0.3,2,1.5,1.9,1.5,2,1.6,2
NYSE:COO,"The Cooper Companies, Inc.",Health Care,Health Care Equipment and Services,Health Care Equipment and Supplies,Health Care Supplies,254.2,18.5,98.6,0,0,"12,491.80","6140 Stoneridge Mall Road, Suite 590, Pleasanton, California, 94588, United States",2.6,11.9,7.5,11.5,5.6,9.2,5.6,7.7,5.5,7.5
NYSE:EL,The Estée Lauder Companies Inc.,Consumer Staples,Household and Personal Products,Personal Products,Personal Products,125.5,16.8,42.5,31,0.012,"45,969.80","767 Fifth Avenue, New York, New York, 10153, United States",3,4.8,2.9,4.2,2.9,3.5,2.9,3.3,2.9,3.1
NYSE:GPS,"The Gap, Inc.",Consumer Discretionary,Retailing,Specialty Retail,Apparel Retail,25.3,4.8,11.1,2.9,0.038,"9,725.40","2 Folsom Street, San Francisco, California, 94105, United States",2.3,2.6,2.2,2.2,1.7,2,1.7,2.4,2.8,2.9
NYSE:GS,"The Goldman Sachs Group, Inc.",Financials,Diversified Financials,Capital Markets,Investment Banking and Brokerage,227,0,16.6,1.2,0.014,"85,690.20","200 West Street, New York, New York, 10282, United States",12.5,24.2,9,19.7,16.3,17.8,16.3,18.1,17.1,16.6
NasdaqGS:GT,The Goodyear Tire & Rubber Company,Consumer Discretionary,Automobiles and Components,Auto Components,Tires and Rubber,20.3,5.2,18.9,1.2,0.032,"4,804.30","200 Innovation Way, Akron, Ohio, 44316, United States",1.1,3.2,1.4,3.5,4.7,4.1,4.7,3.8,8.8,3.1
NYSE:HIG,"The Hartford Financial Services Group, Inc.",Financials,Insurance,Insurance,Multi-line Insurance,46.6,8.8,37.2,1.6,0.026,"16,716.70","One Hartford Plaza, Hartford, Connecticut, 06155, United States",1.3,4.7,-0.7,3.7,1.6,3.8,1.6,3.8,2.9,3.6
NYSE:HSY,The Hershey Company,Consumer Staples,"Food, Beverage and Tobacco",Food Products,Packaged Foods and Meats,106.6,13.8,21.9,0,0.027,"22,308.50","100 Crystal A Drive, Hershey, Pennsylvania, 17033, United States",4.9,5.5,3.7,5.1,3.3,4.5,3.3,4.3,3.8,4.4
NYSE:HD,"The Home Depot, Inc.",Consumer Discretionary,Retailing,Specialty Retail,Home Improvement Retail,179.9,13.2,21.2,0,0.023,"205,773.30","2455 Paces Ferry Road, Atlanta, Georgia, 30339, United States",8.5,10,7.2,8.1,6.2,7,6.2,6,4.4,5.1
NYSE:IPG,"The Interpublic Group of Companies, Inc.",Communication Services,Media and Entertainment,Media,Advertising,24.7,9.6,16.9,0,0.034,"9,460.30","909 Third Avenue, New York, New York, 10022, United States",1.5,1.8,1.5,1.5,1.5,1.4,1.5,1.3,1.1,1.1
NYSE:SJM,The J. M. Smucker Company,Consumer Staples,"Food, Beverage and Tobacco",Food Products,Packaged Foods and Meats,105,11.1,8.9,0,0.032,"11,940.20","One Strawberry Lane, Orrville, Ohio, 44667, United States",11.8,8.4,4.9,8.2,6.1,7.8,6.1,6.1,5.5,5.7
NasdaqGS:KHC,The Kraft Heinz Company,Consumer Staples,"Food, Beverage and Tobacco",Food Products,Packaged Foods and Meats,57.6,12.5,6.6,0,0.043,"70,179.90","One PPG Place, Pittsburgh, Pennsylvania, 15222, United States",8.7,3.7,9,3.8,2.8,3.8,2.8,2.7,-0.2,0
NYSE:KR,The Kroger Co.,Consumer Staples,Food and Staples Retailing,Food and Staples Retailing,Food Retail,27.6,7.2,6.3,7.2,0.02,"21,976.90","1014 Vine Street, Cincinnati, Ohio, 45202, United States",4.4,2.2,1.7,2,2.1,2.1,2.1,2.2,1.6,1.8
NYSE:MOS,The Mosaic Company,Materials,Materials,Chemicals,Fertilizers and Agricultural Chemicals,33.2,11.3,0,1.5,0.003,"12,781.80","Atria Corporate Center, Suite E490, 3033 Campus Drive, Plymouth, Minnesota, 55441, United States",-0.3,2.2,-0.3,1,0.8,0.9,0.8,2.5,2.7,2.9
NYSE:PNC,"The PNC Financial Services Group, Inc.",Financials,Banks,Banks,Regional Banks,125.2,0,10.3,1.5,0.03,"57,823.90","The Tower at PNC Plaza, 300 Fifth Avenue, Pittsburgh, Pennsylvania, 15222, United States",11.5,11.2,10.4,9.2,7.3,7.5,7.3,7.2,7.3,7.1
NYSE:PG,The Procter & Gamble Company,Consumer Staples,Household and Personal Products,Household Products,Household Products,87.3,13.5,23.8,0,0.033,"217,499.90","One Procter & Gamble Plaza, Cincinnati, Ohio, 45202, United States",3.7,4.4,3.7,4.2,3.5,3.9,3.5,3.9,3.6,4.4
NYSE:PGR,The Progressive Corporation,Financials,Insurance,Insurance,Property and Casualty Insurance,70.6,11.2,14.2,3.7,0.016,"41,137.70","6300 Wilson Mills Road, Mayfield Village, Ohio, 44143, United States",3.8,4.6,2.7,2.9,1.8,1.9,1.8,1.9,2.2,1.8
NYSE:SHW,The Sherwin-Williams Company,Materials,Materials,Chemicals,Specialty Chemicals,403.4,17.2,20.6,0,0.009,"37,470.30","101 West Prospect Avenue, Cleveland, Ohio, 44115, United States",19.6,20.8,19.1,17.8,12,13.2,12,12.3,8.8,10.5
NYSE:SO,The Southern Company,Utilities,Utilities,Electric Utilities,Electric Utilities,45.1,11.8,19.5,2.6,0.053,"45,707.10","30 Ivan Allen Jr Boulevard NW, Atlanta, Georgia, 30308, United States",2.3,2.8,0.8,3.1,2.6,3,2.6,2.9,2.2,2.8
NYSE:TJX,"The TJX Companies, Inc.",Consumer Discretionary,Retailing,Specialty Retail,Apparel Retail,107.3,13.2,22.9,13,0.015,"66,368.70","770 Cochituate Road, Framingham, Massachusetts, 01701, United States",4.7,5.1,3.7,4.2,3.4,3.7,3.4,3.5,3,3.4
NYSE:TRV,"The Travelers Companies, Inc.",Financials,Insurance,Insurance,Property and Casualty Insurance,126.1,9.3,14.1,1.8,0.024,"33,393.80","485 Lexington Avenue, New York, New York, 10017, United States",9,11,7.3,8.6,10.3,9.4,10.3,9.7,10.7,9.1
NYSE:DIS,The Walt Disney Company,Communication Services,Media and Entertainment,Entertainment,Movies and Entertainment,118.9,11.5,15,22.6,0.014,"176,833.10","500 South Buena Vista Street, Burbank, California, 91521, United States",7.9,7.3,7,6.2,5.5,5.9,5.5,5.7,4.5,4.7
NYSE:WU,The Western Union Company,Information Technology,Software and Services,IT Services,Data Processing and Outsourced Services,18.2,7.8,0,0,0.042,"8,131.00","12500 East Belford Avenue, Englewood, Colorado, 80112, United States",-1,1.9,-1.2,1.8,0.5,1.7,0.5,1.7,1.6,1.6
NYSE:WMB,"The Williams Companies, Inc.",Energy,Energy,"Oil, Gas and Consumable Fuels",Oil and Gas Storage and Transportation,26.7,15.1,11.1,23.6,0.051,"32,338.60","One Williams Center, Tulsa, Oklahoma, 74172, United States",2.4,1,2.6,0.9,-0.6,0.8,-0.6,1.4,2.9,1.3
NYSE:TMO,Thermo Fisher Scientific Inc.,Health Care,"Pharmaceuticals, Biotechnology and Life Sciences",Life Sciences Tools and Services,Life Sciences Tools and Services,227.2,19.1,38.3,0,0.003,"91,495.20","168 Third Avenue, Waltham, Massachusetts, 02451, United States",5.9,11.6,5.6,10.3,5.1,9,5.1,8,4.7,7.6
NYSE:TIF,Tiffany & Co.,Consumer Discretionary,Retailing,Specialty Retail,Specialty Stores,107,12.4,29.7,4.3,0.021,"13,099.20","727 Fifth Avenue, New York, New York, 10022, United States",3.6,5,3.7,4.2,3.6,3.9,3.6,4.1,1.4,4.7
NYSE:TMK,Torchmark Corporation,Financials,Insurance,Insurance,Life and Health Insurance,86,11.4,6.6,1.9,0.007,"9,660.90","3700 South Stonebridge Drive, McKinney, Texas, 75070, United States",13.1,6.3,12.3,5,4.4,4.6,4.4,4.4,4,4.2
NYSE:TSS,"Total System Services, Inc.",Information Technology,Software and Services,IT Services,Data Processing and Outsourced Services,92.9,19.1,26.4,0,0.006,"16,948.50","One TSYS Way, Columbus, Georgia, 31901, United States",3.5,4.6,3.2,3.6,1.7,3.1,1.7,2.6,1.5,2.1
NasdaqGS:TSCO,Tractor Supply Company,Consumer Discretionary,Retailing,Specialty Retail,Specialty Stores,86.9,12.7,22.6,8.3,0.014,"10,580.00","5401 Virginia Way, Brentwood, Tennessee, 37027, United States",3.8,4.4,3.3,3.5,3.3,3.5,3.3,3.4,2.7,2.9
NYSE:TDG,TransDigm Group Incorporated,Industrials,Capital Goods,Aerospace and Defense,Aerospace and Defense,337.2,16.4,23.5,0,0,"17,745.90","1301 East 9th Street, Suite 3000, Cleveland, Ohio, 44114, United States",14.4,16.3,12.7,13.4,8.6,12.1,8.6,10.6,3.3,8.4
NasdaqGS:TRIP,"TripAdvisor, Inc.",Communication Services,Media and Entertainment,Interactive Media and Services,Interactive Media and Services,46.6,33.9,0,14.4,0,"6,409.70","400 1st Avenue, Needham, Massachusetts, 02494, United States",-0.2,1.5,-0.1,1,0.8,1.6,0.8,2.2,1.6,2.4
NasdaqGS:FOX,"Twenty-First Century Fox, Inc.",Communication Services,Media and Entertainment,Entertainment,Movies and Entertainment,45.5,14.6,0,0,0,"84,674.50","1211 Avenue of the Americas, New York, New York, 10036, United States",2.4,2.1,2.1,2.1,1.6,1.9,1.6,1.9,4.2,1.8
NasdaqGS:FOXA,"Twenty-First Century Fox, Inc.",Communication Services,Media and Entertainment,Entertainment,Movies and Entertainment,45.8,14.6,19,0,0.008,"84,674.50","1211 Avenue of the Americas, New York, New York, 10036, United States",2.4,2.1,2.1,2.1,1.6,1.9,1.6,1.9,4.2,1.8
NYSE:TWTR,"Twitter, Inc.",Communication Services,Media and Entertainment,Interactive Media and Services,Interactive Media and Services,28.8,32.1,93.3,5.1,0,"21,765.20","1355 Market Street, Suite 900, San Francisco, California, 94103, United States",0.3,0.7,-0.2,0.4,-0.7,0.6,-0.7,0.4,-1,0.2
NYSE:TSN,"Tyson Foods, Inc.",Consumer Staples,"Food, Beverage and Tobacco",Food Products,Packaged Foods and Meats,62.4,7.9,8,0,0.019,"22,845.00","2200 Don Tyson Parkway, Springdale, Arkansas, 72762, United States",7.8,5.8,7.6,5.9,5,4.8,5,3.6,2.4,3.4
NYSE:USB,U.S. Bancorp,Financials,Banks,Banks,Diversified Banks,52.5,0,13.1,2.5,0.028,"85,207.50","800 Nicollet Mall, Minneapolis, Minnesota, 55402, United States",3.8,4.2,3.5,3.7,3.2,3.4,3.2,3.3,3.1,3.2
NYSE:UDR,"UDR, Inc.",Real Estate,Real Estate,Equity Real Estate Investment Trusts (REITs),Residential REITs,39.4,24.1,57.9,3.9,0.033,"10,543.90","1745 Shea Center Drive, Suite 200, Highlands Ranch, Colorado, 80129, United States",0.7,0.3,0.4,0.3,1.1,0.2,1.1,0.3,0.6,0.1
NasdaqGS:ULTA,"Ulta Beauty, Inc.",Consumer Discretionary,Retailing,Specialty Retail,Specialty Stores,270.8,14.6,26.4,8.9,0,"16,184.60","1000 Remington Boulevard, Suite 120, Bolingbrook, Illinois, 60440, United States",10.2,11.8,7.8,9.5,6,7.4,6,5.4,3.7,4.3
NYSE:UA,"Under Armour, Inc.",Consumer Discretionary,Consumer Durables and Apparel,"Textiles, Apparel and Luxury Goods","Apparel, Accessories and Luxury Goods",16.8,25.4,0,0,0,"7,783.70","1020 Hull Street, Baltimore, Maryland, 21230, United States",-0.4,0.3,-0.1,0.2,0.5,0.7,0.5,0,0.5,0
NYSE:UAA,"Under Armour, Inc.",Consumer Discretionary,Consumer Durables and Apparel,"Textiles, Apparel and Luxury Goods","Apparel, Accessories and Luxury Goods",18.2,25.4,0,6.1,0,"7,783.70","1020 Hull Street, Baltimore, Maryland, 21230, United States",-0.4,0.2,-0.1,0.1,0.5,0.6,0.5,0.6,0.5,0.6
NYSE:UNP,Union Pacific Corporation,Industrials,Transportation,Road and Rail,Railroads,148.7,12.4,10.3,5.7,0.022,"109,962.80","1400 Douglas Street, Omaha, Nebraska, 68179, United States",14.4,8.3,13.4,6.2,5.1,5.4,5.1,5.9,5.8,6.3
NasdaqGS:UAL,"United Continental Holdings, Inc.",Industrials,Transportation,Airlines,Airlines,87.4,6,11,15.2,0,"23,821.60","233 South Wacker Drive, Chicago, Illinois, 60606, United States",7.9,8.7,7,6.2,6.9,6.6,6.9,9.4,2.9,7.9
NYSE:UPS,"United Parcel Service, Inc.",Industrials,Transportation,Air Freight and Logistics,Air Freight and Logistics,116.5,12.1,19.6,0,0.031,"100,221.60","55 Glenlake Parkway, N.E., Atlanta, Georgia, 30328, United States",5.9,7.5,5.6,6.3,3.9,6,3.9,5.6,3.3,5.5
NYSE:URI,"United Rentals, Inc.",Industrials,Capital Goods,Trading Companies and Distributors,Trading Companies and Distributors,117.1,8.5,5.9,0,0,"9,498.70","100 First Stamford Place, Suite 700, Stamford, Connecticut, 06902, United States",19.9,16,15.7,12.1,6.5,8.5,6.5,8.7,5.2,7.9
NYSE:UTX,United Technologies Corporation,Industrials,Capital Goods,Aerospace and Defense,Aerospace and Defense,128.7,11.6,20.3,0,0.022,"102,956.00","10 Farm Springs Road, Farmington, Connecticut, 06032, United States",6.4,7.3,5.7,6.7,6.1,6.5,6.1,6.3,6.7,6.8
NYSE:UNH,UnitedHealth Group Incorporated,Health Care,Health Care Equipment and Services,Health Care Providers and Services,Managed Health Care,265.3,15,20.8,5,0.014,"255,344.20","UnitedHealth Group Center, 9900 Bren Road East, Minnetonka, Minnesota, 55343, United States",12,13.5,10.7,10.6,7.3,9.1,7.3,7.1,5.7,6
NYSE:UHS,"Universal Health Services, Inc.",Health Care,Health Care Equipment and Services,Health Care Providers and Services,Health Care Facilities,125.8,9.2,14.7,7.8,0.003,"11,741.80","Universal Corporate Center, 367 South Gulph Road, PO Box 61558, King Of Prussia, Pennsylvania, 19406, United States",8.5,9.9,7.8,7.8,7.1,7.9,7.1,7.3,5.4,6.3
NYSE:UNM,Unum Group,Financials,Insurance,Insurance,Life and Health Insurance,37.7,6.8,7.8,0.9,0.028,"8,234.30","1 Fountain Square, Chattanooga, Tennessee, 37402, United States",4.8,5.3,4.4,4.4,4,4,4,3.8,1.6,3.6
NYSE:VFC,V.F. Corporation,Consumer Discretionary,Consumer Durables and Apparel,"Textiles, Apparel and Luxury Goods","Apparel, Accessories and Luxury Goods",77.8,19,27.8,92.5,0.024,"30,828.80","105 Corporate Center Boulevard, Greensboro, North Carolina, 27408, United States",2.7,3.7,1.8,0,2.6,3.3,2.6,3.4,2.9,3.4
NYSE:VLO,Valero Energy Corporation,Energy,Energy,"Oil, Gas and Consumable Fuels",Oil and Gas Refining and Marketing,92.8,7.1,8.9,1.8,0.034,"39,645.40","One Valero Way, San Antonio, Texas, 78249, United States",10.4,8,9.2,6.4,4.9,5.3,4.9,7.8,7,5.6
NYSE:VAR,"Varian Medical Systems, Inc.",Health Care,Health Care Equipment and Services,Health Care Equipment and Supplies,Health Care Equipment,104.2,15.1,67.5,8.1,0,"9,538.30","3100 Hansen Way, Palo Alto, California, 94304, United States",1.5,4.6,1.5,4.3,2.7,4.9,2.7,4.5,3.8,4.3
NYSE:VTR,"Ventas, Inc.",Real Estate,Real Estate,Equity Real Estate Investment Trusts (REITs),Health Care REITs,55.9,16.3,16.1,2.2,0.056,"19,939.20","353 North Clark Street, Suite 3300, Chicago, Illinois, 60654, United States",3.5,1.5,3.8,2.1,1.9,1.7,1.9,2.3,1.3,1.8
NasdaqGS:VRSN,"VeriSign, Inc.",Information Technology,Software and Services,IT Services,Internet Services and Infrastructure,141.4,22.7,36.5,0,0,"17,238.10","12061 Bluemont Way, Reston, Virginia, 20190, United States",3.9,4.9,3.7,4.1,3.4,3.7,3.4,3.3,2.5,3
NasdaqGS:VRSK,"Verisk Analytics, Inc.",Industrials,Commercial and Professional Services,Professional Services,Research and Consulting Services,116.1,20.8,32,0,0,"19,129.20","545 Washington Boulevard, Jersey City, New Jersey, 07310, United States",3.6,4.3,3.3,3.4,2.6,3.3,2.6,3.1,2.1,2.6
NYSE:VZ,Verizon Communications Inc.,Communication Services,Telecommunication Services,Diversified Telecommunication Services,Integrated Telecommunication Services,54.9,7.3,7.3,0,0.044,"226,843.30","1095 Avenue of the Americas, New York, New York, 10036, United States",7.5,4.7,7.4,3.9,3.2,4,3.2,4,2.4,3.6
NasdaqGS:VRTX,Vertex Pharmaceuticals Incorporated,Health Care,"Pharmaceuticals, Biotechnology and Life Sciences",Biotechnology,Biotechnology,175.7,73.3,108.9,17.2,0,"44,899.30","50 Northern Avenue, Boston, Massachusetts, 02210, United States",1.6,4.3,1,2.5,-0.5,1.5,-0.5,2,-3.1,-1.1
NasdaqGS:VIAB,"Viacom, Inc.",Communication Services,Media and Entertainment,Entertainment,Movies and Entertainment,33.2,7.9,6.8,0,0.024,"13,568.10","1515 Broadway, New York, New York, 10036, United States",4.9,4.2,5,3.7,3.5,3.8,3.5,5.8,5.4,6
NYSE:V,Visa Inc.,Information Technology,Software and Services,IT Services,Data Processing and Outsourced Services,140.1,23.5,34.2,0,0.007,"311,694.10","PO Box 8999, San Francisco, California, 94128, United States",4.1,5.1,3,4.1,2.5,3.3,2.5,2.9,2.3,2.6
NYSE:VNO,Vornado Realty Trust,Real Estate,Real Estate,Equity Real Estate Investment Trusts (REITs),Office REITs,68.3,24.9,94.6,4,0.037,"12,997.10","888 Seventh Avenue, New York, New York, 10019, United States",0.7,1.8,0.9,0.9,2.2,1.9,2.2,1.8,1,2.3
NYSE:VMC,Vulcan Materials Company,Materials,Materials,Construction Materials,Construction Materials,92.8,15.3,19.2,17.5,0.012,"12,279.80","1200 Urban Center Drive, Birmingham, Alabama, 35242, United States",4.8,4.5,4.4,3.6,3.1,3.8,3.1,3,1.6,1.6
NYSE:GWW,"W.W. Grainger, Inc.",Industrials,Capital Goods,Trading Companies and Distributors,Trading Companies and Distributors,276.3,11.1,21.8,13.1,0.02,"15,560.20","100 Grainger Parkway, Lake Forest, Illinois, 60045, United States",13.6,16.8,10,10.7,9.9,11.6,9.9,11.5,11.4,13.1
NasdaqGS:WBA,"Walgreens Boots Alliance, Inc.",Consumer Staples,Food and Staples Retailing,Food and Staples Retailing,Drug Retail,77.4,10.8,15.3,0,0.023,"73,417.90","108 Wilmot Road, Deerfield, Illinois, 60015, United States",5.1,6.5,3.6,5.6,3.8,5,3.8,4.4,2.1,3.8
NYSE:WMT,Walmart Inc.,Consumer Staples,Food and Staples Retailing,Food and Staples Retailing,Hypermarkets and Super Centers,97.2,10,55.6,5.3,0.021,"284,526.60","702 SW 8th Street, Bentonville, Arkansas, 72716, United States",1.7,4.7,3.8,4.6,4.6,4.3,4.6,4.3,4.8,5.1
NYSE:WM,"Waste Management, Inc.",Industrials,Commercial and Professional Services,Commercial Services and Supplies,Environmental and Facilities Services,90.4,12,18.1,0,0.021,"38,773.20","1001 Fannin Street, Suite 4000, Houston, Texas, 77002, United States",5,4.2,4.4,3.4,2.7,3.1,2.7,2.7,2.8,2.5
NYSE:WAT,Waters Corporation,Health Care,"Pharmaceuticals, Biotechnology and Life Sciences",Life Sciences Tools and Services,Life Sciences Tools and Services,185.4,16,292,10.2,0,"14,289.80","34 Maple Street, Milford, Massachusetts, 01757, United States",0.6,8.5,0.3,7.9,6.4,6.9,6.4,6.2,5.1,5.7
NYSE:WEC,"WEC Energy Group, Inc.",Utilities,Utilities,Multi-Utilities,Multi-Utilities,70.6,12.6,17.6,3.3,0.031,"22,267.20","231 West Michigan Street, Milwaukee, Wisconsin, 53203, United States",4,3.2,3.8,2.8,3,3,3,2.9,2.6,2.6
NYSE:WCG,"WellCare Health Plans, Inc.",Health Care,Health Care Equipment and Services,Health Care Providers and Services,Managed Health Care,308.7,14.3,28.7,8.4,0,"15,429.30","8725 Henderson Road, Renaissance One, Tampa, Florida, 33634, United States",10.8,11.8,8.3,7.1,5.4,5.8,5.4,4.2,1.4,3.2
NYSE:WFC,Wells Fargo & Company,Financials,Banks,Banks,Diversified Banks,52.9,0,12.5,1.7,0.033,"249,194.50","420 Montgomery Street, San Francisco, California, 94163, United States",3.9,5,4.1,4.2,4,4.1,4,4.3,4.1,4.2
NYSE:WELL,Welltower Inc.,Real Estate,Real Estate,Equity Real Estate Investment Trusts (REITs),Health Care REITs,64.5,19,43.2,1.8,0.054,"23,984.60","4500 Dorr Street, Toledo, Ohio, 43615, United States",1.5,1.8,1.3,1.9,2.8,2,2.8,2.1,1.4,1.8
NasdaqGS:WDC,Western Digital Corporation,Information Technology,Technology Hardware and Equipment,"Technology Hardware, Storage and Peripherals","Technology Hardware, Storage and Peripherals",56.5,3.8,25.7,0,0.035,"16,408.20","5601 Great Oaks Parkway, San Jose, California, 95119, United States",2.2,11.1,1.3,13.2,-1.6,7.6,-1.6,6.5,6.4,8.4
NYSE:WRK,WestRock Company,Materials,Materials,Containers and Packaging,Paper Packaging,42.5,6.2,6.1,4.1,0.04,"10,711.50","1000 Abernathy Road, Suite L-2, Atlanta, Georgia, 30328, United States",7,4.5,6.9,3.7,0.8,2.9,0.8,3.5,3.4,0
NYSE:WY,Weyerhaeuser Company,Real Estate,Real Estate,Equity Real Estate Investment Trusts (REITs),Specialized REITs,28.5,12.5,22,2.3,0.048,"21,624.20","220 Occidental Avenue South, Seattle, Washington, 98104, United States",1.3,1.4,0.8,1.3,0.5,1,0.5,1.4,1,1.5
NYSE:WHR,Whirlpool Corporation,Consumer Discretionary,Consumer Durables and Apparel,Household Durables,Household Appliances,106.9,6.8,0,0,0.043,"6,901.20","2000 North M-63, Benton Harbor, Michigan, 49022, United States",-7.8,15.4,4.7,15.2,11.5,15.3,11.5,13.6,8.2,13.3
NasdaqGS:WLTW,Willis Towers Watson Public Limited Company,Financials,Insurance,Insurance,Insurance Brokers,140,15.8,40.4,0,0.017,"18,305.10","51 Lime Street, London, Greater London, EC3M 7DQ, United Kingdom",3.5,9.9,4.2,9.4,3.3,8.1,3.3,0,5.3,0
