constituents,companyName ,sector ,industryGroup ,industry ,subIndustry ,dividendAdjustedSplitAdjustedClosingStockPrice,bevEbitdaMultiples ,priceEarningsMultiples ,priceTangibleBook ,dividendYield ,marketCapitalization ,headquarterLocation ,actual2018,estimated2018,actual2017,estimated2017,actual2016,estimated2016,actual2015,estimated2015,actual2014,estimated2014
NYSE:MMM,3M Company,Industrials,Capital Goods,Industrial Conglomerates,Industrial Conglomerates,199.9,15.1,27.7,0,0.027,"117,234.70","3M Center, St. Paul, Minnesota, 55144, United States",7.2,10.6,7.9,9.4,8.2,8.4,8.2,7.9,7.5,8.1
NYSE:AOS,A. O. Smith Corporation,Industrials,Capital Goods,Building Products,Building Products,45.2,11.8,23.8,8.4,0.019,"7,708.00","11270 West Park Place, Milwaukee, Wisconsin, 53224, United States",1.9,2.8,1.7,2.3,1.9,2,1.9,1.7,1.1,1.3
NYSE:ABT,Abbott Laboratories,Health Care,Health Care Equipment and Services,Health Care Equipment and Supplies,Health Care Equipment,67.6,20.7,147.8,0,0.017,"118,574.40","100 Abbott Park Road, Abbott Park, Illinois, 60064, United States",0.5,3,0.2,2.8,0.7,2.4,0.7,2.3,1.1,2.3
NYSE:ABBV,AbbVie Inc.,Health Care,"Pharmaceuticals, Biotechnology and Life Sciences",Biotechnology,Biotechnology,88,12.9,21.8,0,0.044,"133,210.60","1 North Waukegan Road, North Chicago, Illinois, 60064, United States",4,8.2,3.3,6.2,3.6,5.2,3.6,4.8,1.1,3.9
NasdaqGS:ABMD,"ABIOMED, Inc.",Health Care,Health Care Equipment and Services,Health Care Equipment and Supplies,Health Care Equipment,362.4,86.8,101,23.6,0,"16,264.40","22 Cherry Hill Drive, Danvers, Massachusetts, 01923, United States",3.6,3.8,2,2.3,1.1,1.5,1.1,0.8,0.4,0.3
NYSE:ACN,Accenture plc,Information Technology,Software and Services,IT Services,IT Consulting and Other Services,158.3,14.3,25,20.4,0.018,"101,417.60","1 Grand Canal Square, Grand Canal Harbour, Dublin, Co. Dublin, 2, Ireland",6.2,7.2,5.6,6.7,6.8,5.9,6.8,5.4,4.7,4.8
NasdaqGS:ATVI,"Activision Blizzard, Inc.",Communication Services,Media and Entertainment,Entertainment,Interactive Home Entertainment,69.8,23.5,106.2,0,0.005,"53,178.00","3100 Ocean Park Boulevard, Santa Monica, California, 90405, United States",0.7,2.9,0.4,2.4,1.3,2,1.3,1.5,1.1,1.3
NasdaqGS:ADBE,Adobe Inc.,Information Technology,Software and Services,Software,Application Software,245,37.7,50.6,113.5,0,"119,607.40","345 Park Avenue, San Jose, California, 95110, United States",4.8,7.6,3.4,5.6,2.3,3.8,2.3,2.8,0.5,2.1
NYSE:AAP,"Advance Auto Parts, Inc.",Consumer Discretionary,Retailing,Specialty Retail,Automotive Retail,164.3,13.2,22.8,5.8,0.001,"12,173.60","5008 Airport Road, Roanoke, Virginia, 24012, United States",7.2,7.5,6.4,5.7,6.2,7.6,6.2,8.9,6.2,8.5
NasdaqGS:AMD,"Advanced Micro Devices, Inc.",Information Technology,Semiconductors and Semiconductor Equipment,Semiconductors and Semiconductor Equipment,Semiconductors,23.7,37.6,81.8,77.4,0,"23,065.50","2485 Augustine Drive, Santa Clara, California, 95054, United States",0.3,0.5,0,0.3,-0.6,0,-0.6,-0.4,-0.5,0.1
NYSE:AET,Aetna Inc.,Health Care,Health Care Equipment and Services,Health Care Providers and Services,Managed Health Care,200.2,10.9,18.9,11.5,0.01,"65,542.20","151 Farmington Avenue, Hartford, Connecticut, 06156, United States",10.6,11.5,5.7,9.3,6.4,8.4,6.4,7.8,5.7,6.9
NYSE:AMG,"Affiliated Managers Group, Inc.",Financials,Diversified Financials,Capital Markets,Asset Management and Custody Banks,123.3,7.9,9.7,0,0.01,"6,588.70","777 South Flagler Drive, West Palm Beach, Florida, 33401, United States",12.7,15.7,12,15.8,8.6,14,8.6,13.3,7.7,12.5
NYSE:AFL,Aflac Incorporated,Financials,Insurance,Insurance,Life and Health Insurance,44.5,8.5,7.2,1.4,0.023,"34,144.10","1932 Wynnton Road, Columbus, Georgia, 31999, United States",6.2,4,5.8,3.4,3.2,3.3,3.2,3.1,3.3,3
NYSE:A,"Agilent Technologies, Inc.",Health Care,"Pharmaceuticals, Biotechnology and Life Sciences",Life Sciences Tools and Services,Life Sciences Tools and Services,64.5,17.3,70.6,18.4,0.009,"20,551.10","5301 Stevens Creek Boulevard, Santa Clara, California, 95051, United States",0.9,2.9,2.1,2.6,1.4,2.2,1.4,1.9,0.7,1.7
NYSE:APD,"Air Products and Chemicals, Inc.",Materials,Materials,Chemicals,Industrial Gases,155.4,11.9,23.2,3.7,0.028,"34,074.90","7201 Hamilton Boulevard, Allentown, Pennsylvania, 18195, United States",6.7,8,4.7,7,4.9,6.4,4.9,7.4,4.8,6.5
NasdaqGS:AKAM,"Akamai Technologies, Inc.",Information Technology,Software and Services,IT Services,Internet Services and Infrastructure,64.2,15.7,60.2,6.2,0,"10,889.00","150 Broadway, Cambridge, Massachusetts, 02142, United States",1.1,3.6,1.3,2.6,1.8,2.8,1.8,2.6,1.8,2.6
NYSE:ALK,"Alaska Air Group, Inc.",Industrials,Transportation,Airlines,Airlines,62.6,6.2,9.1,5.1,0.02,"7,722.20","19300 International Boulevard, Seattle, Washington, 98188, United States",6.8,4.9,8.4,5.9,6.5,7.1,6.5,7.1,4.4,5.1
NYSE:ALB,Albemarle Corporation,Materials,Materials,Chemicals,Specialty Chemicals,95.6,10.9,31.9,6.1,0.014,"10,371.10","4350 Congress Street, Suite 700, Charlotte, North Carolina, 28209, United States",3,5.8,0.5,5,3.9,3.7,3.9,3.8,2.6,4.4
NYSE:ARE,"Alexandria Real Estate Equities, Inc.",Real Estate,Real Estate,Equity Real Estate Investment Trusts (REITs),Office REITs,122.4,24.4,43.8,2,0.03,"12,946.80","385 East Colorado Boulevard, Suite 299, Pasadena, California, 91101, United States",2.8,2.4,1.6,1.9,-2,1.8,-2,1.9,1,1.7
NasdaqGS:ALXN,"Alexion Pharmaceuticals, Inc.",Health Care,"Pharmaceuticals, Biotechnology and Life Sciences",Biotechnology,Biotechnology,125.9,17.6,0,0,0,"28,055.70","121 Seaport Boulevard, Boston, Massachusetts, 02210, United States",-0.5,7.6,2,6.4,1.8,5.4,1.8,5,3.3,5.5
NasdaqGS:ALGN,"Align Technology, Inc.",Health Care,Health Care Equipment and Services,Health Care Equipment and Supplies,Health Care Supplies,312.8,52.1,86.7,22.2,0,"25,123.30","2820 Orchard Parkway, San Jose, California, 95134, United States",3.6,5.4,2.8,4.1,2.3,2.8,2.3,2.1,1.8,2
NYSE:ALLE,Allegion plc,Industrials,Capital Goods,Building Products,Building Products,81.8,15.5,27.5,0,0.01,"7,770.30","Iveagh Court, Block D, Harcourt Road, Dublin, Co. Dublin, 2, Ireland",3,4.7,2.9,4.1,2.4,3.6,2.4,3.3,1.9,2.9
NYSE:AGN,Allergan plc,Health Care,"Pharmaceuticals, Biotechnology and Life Sciences",Pharmaceuticals,Pharmaceuticals,189.5,11.9,0,0,0.015,"64,334.90","Clonshaugh Business and Technology Park, Coolock, Dublin, Co. Dublin, D17 E400, Ireland",-4.1,16.2,-12,16.5,-3.2,15.4,-3.2,15.5,-11.3,15.8
NYSE:ADS,Alliance Data Systems Corporation,Information Technology,Software and Services,IT Services,Data Processing and Outsourced Services,216.2,18.4,12.6,0,0.011,"11,877.70","7500 Dallas Parkway, Suite 700, Plano, Texas, 75024, United States",15.9,24.6,14.1,20.6,7.3,18.2,7.3,16.7,7.9,14.2
NYSE:LNT,Alliant Energy Corporation,Utilities,Utilities,Electric Utilities,Electric Utilities,44.1,13.2,21.1,2.4,0.03,"10,482.70","4902 North Biltmore Lane, Madison, Wisconsin, 53718, United States",2.1,2.1,2,2.3,1.6,2.1,1.6,1.9,1.7,1.8
NasdaqGS:GOOG,Alphabet Inc.,Communication Services,Media and Entertainment,Interactive Media and Services,Interactive Media and Services,1096.5,17.5,0,0,0,"765,798.20","1600 Amphitheatre Parkway, Mountain View, California, 94043, United States",23.2,44.8,18,39.6,27.9,39.4,27.9,32.4,19.8,28.8
NasdaqGS:GOOG.L,Alphabet Inc.,Communication Services,Media and Entertainment,Interactive Media and Services,Interactive Media and Services,1105.2,17.5,47.7,5.4,0,"765,798.20","1600 Amphitheatre Parkway, Mountain View, California, 94043, United States",23.2,43.8,18,39.6,27.9,39.4,27.9,32.4,19.8,28.9
NYSE:MO,"Altria Group, Inc.",Consumer Staples,"Food, Beverage and Tobacco",Tobacco,Tobacco,62,11.7,11.1,0,0.052,"116,786.30","6601 West Broad Street, Richmond, Virginia, 23230, United States",5.6,4.2,5.3,3.5,7.3,3.2,7.3,3,2.6,2.8
NasdaqGS:AMZN,"Amazon.com, Inc.",Consumer Discretionary,Retailing,Internet and Direct Marketing Retail,Internet and Direct Marketing Retail,1764,42.6,139.7,40.8,0,"860,390.10","410 Terry Avenue North, Seattle, Washington, 98109, United States",12.6,20.1,6.2,6.1,4.9,7.2,4.9,4.4,-0.5,0.1
NYSE:AEE,Ameren Corporation,Utilities,Utilities,Multi-Utilities,Multi-Utilities,66.1,10.2,26.2,2.3,0.029,"16,118.80","1901 Chouteau Avenue, MC 1370, St. Louis, Missouri, 63103, United States",2.5,3.3,2.1,2.8,2.7,2.7,2.7,2.3,2.4,2.5
NasdaqGS:AAL,American Airlines Group Inc.,Industrials,Transportation,Airlines,Airlines,32,5.7,10.4,0,0.012,"14,754.70","4333 Amon Carter Boulevard, Fort Worth, Texas, 76155, United States",3.1,4.5,3.9,4.8,4.8,4.5,4.8,7.1,3.9,8.4
NYSE:AEP,"American Electric Power Company, Inc.",Utilities,Utilities,Electric Utilities,Electric Utilities,73.3,11.3,18.7,1.9,0.034,"36,112.30","1 Riverside Plaza, Columbus, Ohio, 43215, United States",3.9,4,3.9,3.8,1.2,3.6,1.2,3.6,3.2,3.3
NYSE:AXP,American Express Company,Financials,Diversified Financials,Consumer Finance,Consumer Finance,106.7,0,25.7,4.3,0.015,"91,147.40","200 Vesey Street, lower Manhattan, New York, New York, 10285, United States",3.8,7.5,3,6.3,5.7,5.2,5.7,5.2,5.6,5.9
NYSE:AIG,"American International Group, Inc.",Financials,Insurance,Insurance,Multi-line Insurance,47.2,11.5,0,0.7,0.027,"41,934.70","175 Water Street, New York, New York, 10038, United States",-7.2,5.1,-6.5,4.7,-0.7,5.1,-0.7,4.9,5.2,4.8
NYSE:AMT,American Tower Corporation (REIT),Real Estate,Real Estate,Equity Real Estate Investment Trusts (REITs),Specialized REITs,150.2,21.5,59.5,0,0.021,"66,191.40","116 Huntington Avenue, 11th Floor, Boston, Massachusetts, 02116, United States",2.5,3.5,2.7,3.4,2,2.6,2,2.3,2,2.6
NYSE:AWK,"American Water Works Company, Inc.",Utilities,Utilities,Water Utilities,Water Utilities,91.9,14.9,35.1,4.1,0.02,"16,594.50","1025 Laurel Oak Road, Voorhees, New Jersey, 08043, United States",2.6,3.3,2.4,3.2,2.6,2.9,2.6,2.8,2.4,2.6
NYSE:AMP,"Ameriprise Financial, Inc.",Financials,Diversified Financials,Capital Markets,Asset Management and Custody Banks,135.9,5.8,11.9,3.4,0.026,"19,273.60","55 Ameriprise Financial Center, Minneapolis, Minnesota, 55474, United States",11.4,15.5,9.4,12.7,7.8,10.1,7.8,10,8.3,9.3
NYSE:ABC,AmerisourceBergen Corporation,Health Care,Health Care Equipment and Services,Health Care Providers and Services,Health Care Distributors,92.8,9.5,19,0,0.016,"20,077.90","1300 Morris Drive, Chesterbrook, Pennsylvania, 19087, United States",4.9,6.9,4.4,6.1,6,5.8,6,5.8,0.2,4.5
NYSE:AME,"AMETEK, Inc.",Industrials,Capital Goods,Electrical Equipment,Electrical Components and Equipment,70.6,14.9,21.4,0,0.008,"16,374.30","1100 Cassatt Road, Berwyn, Pennsylvania, 19312, United States",3.3,3.4,2.9,2.8,2.2,2.4,2.2,2.7,2.4,2.6
NasdaqGS:AMGN,Amgen Inc.,Health Care,"Pharmaceuticals, Biotechnology and Life Sciences",Biotechnology,Biotechnology,201.8,10.8,60.5,0,0.026,"130,619.50","One Amgen Center Drive, Thousand Oaks, California, 91320, United States",3.3,14,2.7,12.5,10.2,11.9,10.2,10.2,6.7,8.9
NYSE:APH,Amphenol Corporation,Information Technology,Technology Hardware and Equipment,"Electronic Equipment, Instruments and Components",Electronic Components,83,15.2,36.1,0,0.011,"24,920.30","358 Hall Avenue, PO Box 5030, Wallingford, Connecticut, 06492, United States",2.3,3.8,2.1,3.3,2.6,2.9,2.6,2.5,2.2,2.4
NYSE:APC,Anadarko Petroleum Corporation,Energy,Energy,"Oil, Gas and Consumable Fuels",Oil and Gas Exploration and Production,66,10.6,84,10.2,0.015,"33,797.00","1201 Lake Robbins Drive, The Woodlands, Texas, 77380, United States",0.8,4,-0.9,-0.4,-5.9,-0.6,-5.9,-2.7,-3.5,2.9
NasdaqGS:ADI,"Analog Devices, Inc.",Information Technology,Semiconductors and Semiconductor Equipment,Semiconductors and Semiconductor Equipment,Semiconductors,82.3,13.1,21.9,0,0.023,"30,601.40","One Technology Way, PO Box 9106, Norwood, Massachusetts, 02062, United States",3.8,5.8,2.1,5.2,2.8,3.4,2.8,3.3,2,2.8
NasdaqGS:ANSS,"ANSYS, Inc.",Information Technology,Software and Services,Software,Application Software,150.6,25.6,42.9,18.1,0,"12,693.60","2600 ANSYS Drive, Canonsburg, Pennsylvania, 15317, United States",3.5,5.2,3,4.1,3,3.7,3,3.5,2.7,3.4
NYSE:ANTM,"Anthem, Inc.",Health Care,Health Care Equipment and Services,Health Care Providers and Services,Managed Health Care,279.2,14.4,17,0,0.011,"72,566.10","120 Monument Circle, Indianapolis, Indiana, 46204, United States",16.4,16.5,14.4,12.2,9.2,11.4,9.2,10.5,9,9.3
NYSE:AON,Aon plc,Financials,Insurance,Insurance,Insurance Brokers,151.1,18.8,45.7,0,0.011,"36,665.20","The Leadenhall Building, The Aon Centre, 122 Leadenhall Street, London, Greater London, EC3V 4AN, United Kingdom",3.3,8.6,1.5,7.5,4.5,6.8,4.5,6.2,4.7,5.8
NYSE:APA,Apache Corporation,Energy,Energy,"Oil, Gas and Consumable Fuels",Oil and Gas Exploration and Production,42.1,6.2,18.8,2.1,0.024,"16,102.70","One Post Oak Central, Suite 100, 2000 Post Oak Boulevard, Houston, Texas, 77056, United States",2.2,2,3.4,0.9,-3.6,1.2,-3.6,-0.8,-17.3,2
NYSE:AIV,Apartment Investment and Management Company,Real Estate,Real Estate,Equity Real Estate Investment Trusts (REITs),Residential REITs,43.2,19.1,18.6,4.6,0.035,"6,802.30","4582 South Ulster Street, Suite 1100, Denver, Colorado, 80237, United States",2.3,0.3,2,0.7,2.7,0.3,2.7,0.5,2.1,0.4
NasdaqGS:AAPL,Apple Inc.,Information Technology,Technology Hardware and Equipment,"Technology Hardware, Storage and Peripherals","Technology Hardware, Storage and Peripherals",219.3,14,19.9,9.2,0.013,"1,059,251.90","1 Infinite Loop, Cupertino, California, 95014, United States",11,13.4,9.7,11.5,8.3,9,8.3,9.8,7.4,7.8
NasdaqGS:AMAT,"Applied Materials, Inc.",Information Technology,Semiconductors and Semiconductor Equipment,Semiconductors and Semiconductor Equipment,Semiconductor Equipment,34.3,6.6,10.5,10.6,0.023,"33,706.70","3050 Bowers Avenue, PO Box 58039, Santa Clara, California, 95052, United States",3.3,4,3.2,4,1.5,2.4,1.5,1.2,0.9,1.3
NYSE:APTV,Aptiv PLC,Consumer Discretionary,Automobiles and Components,Auto Components,Auto Parts and Equipment,74.3,10.2,18.2,162.6,0.012,"19,667.40","C, Ardilaun Court, 112-114 St. Stephens Green, Dublin, Co. Dublin, 2, Ireland",4.1,5.5,3.7,5.1,2.9,6.3,2.9,6,4.3,5.5
NYSE:ADM,Archer-Daniels-Midland Company,Consumer Staples,"Food, Beverage and Tobacco",Food Products,Agricultural Products,49.5,11,14.5,1.9,0.027,"27,729.40","77 West Wacker Drive, Suite 4600, Chicago, Illinois, 60601, United States",3.4,3.6,2.8,2.6,2.2,2.9,2.2,2.9,3.4,3.5
NYSE:ARNC,Arconic Inc.,Industrials,Capital Goods,Aerospace and Defense,Aerospace and Defense,21.9,8.9,0,0,0.011,"10,567.00","390 Park Avenue, New York, New York, 10022, United States",-0.8,1.4,-0.3,1.4,-2.6,1.2,-2.6,0,-0.2,0
NYSE:ANET,"Arista Networks, Inc.",Information Technology,Technology Hardware and Equipment,Communications Equipment,Communications Equipment,229.8,25.4,78,10,0,"17,191.50","5453 Great America Parkway, Santa Clara, California, 95054, United States",2.9,7.8,5.3,5.9,2.5,3.3,2.5,2.5,1.3,1.5
NYSE:AJG,Arthur J. Gallagher & Co.,Financials,Insurance,Insurance,Insurance Brokers,72.7,15.8,24.2,0,0.023,"13,270.40","2850 Golf Road, Rolling Meadows, Illinois, 60008, United States",3,3.7,2.5,3.3,2.3,3,2.3,2.7,2,2.6
NYSE:AIZ,"Assurant, Inc.",Financials,Insurance,Insurance,Multi-line Insurance,106.2,14.9,13.9,2.9,0.021,"6,634.40","28 Liberty Street, 41st Floor, New York, New York, 10005, United States",7.7,7.9,9.4,6.7,9.1,5,9.1,6.4,6.4,6.5
NYSE:T,AT&T Inc.,Communication Services,Telecommunication Services,Diversified Telecommunication Services,Integrated Telecommunication Services,32.9,9.2,6.4,0,0.061,"238,701.90","208 South Akard Street, Dallas, Texas, 75202, United States",5.1,3.6,4.8,2.9,2.1,2.9,2.1,2.8,1.2,2.5
NasdaqGS:ADSK,"Autodesk, Inc.",Information Technology,Software and Services,Software,Application Software,133.2,0,0,0,0,"29,115.40","111 McInnis Parkway, San Rafael, California, 94903, United States",-1.9,2,-2.6,0.7,-2,-0.5,-2,-0.3,0.5,1.3
NasdaqGS:ADP,"Automatic Data Processing, Inc.",Information Technology,Software and Services,IT Services,Data Processing and Outsourced Services,143.4,21.4,39.2,190.9,0.019,"62,733.20","One ADP Boulevard, Roseland, New Jersey, 07068, United States",3.7,5.2,3.9,4,3.7,3.7,3.7,3.3,2.7,3
NYSE:AZO,"AutoZone, Inc.",Consumer Discretionary,Retailing,Specialty Retail,Automotive Retail,725.8,10.1,14.9,0,0,"18,683.50","123 South Front Street, Memphis, Tennessee, 38103, United States",49.2,57.5,44.8,47.8,41.8,46.6,41.8,41.8,32.6,36.8
NYSE:AVB,"AvalonBay Communities, Inc.",Real Estate,Real Estate,Equity Real Estate Investment Trusts (REITs),Residential REITs,178,22.2,28.2,2.4,0.033,"24,598.80","Ballston Tower, Suite 800, 671 North Glebe Road, Arlington, Virginia, 22203, United States",6.3,4.8,6.4,4.7,7.5,4.5,7.5,4.3,4.9,3.7
NYSE:AVY,Avery Dennison Corporation,Materials,Materials,Containers and Packaging,Paper Packaging,97.6,10.7,32.5,0,0.021,"8,530.30","207 Goode Avenue, Glendale, California, 91203, United States",3,6.3,3.1,5.5,3.5,4.3,3.5,3.6,2.3,3.3
NYSE:BHGE,"Baker Hughes, a GE company",Energy,Energy,Energy Equipment and Services,Oil and Gas Equipment and Services,29.9,16.1,0,0,0.024,"12,324.80","17021 Aldine Westfield Road, Houston, Texas, 77073, United States",-0.1,1.1,-0.2,0.8,0,0,0,0,0,0
NYSE:BLL,Ball Corporation,Materials,Materials,Containers and Packaging,Metal and Glass Containers,45.9,12.1,36.4,0,0.009,"15,795.90","10 Longs Peak Drive, PO Box 5000, Broomfield, Colorado, 80021, United States",1.3,2.4,1.1,2.2,0.8,2,0.8,1.8,1.7,2
NYSE:BAC,Bank of America Corporation,Financials,Banks,Banks,Diversified Banks,28.3,0,13.5,1.6,0.021,"279,185.60","Bank of America Corporate Center, 100 North Tryon Street, Charlotte, North Carolina, 28255, United States",1.9,2.8,1.6,2.1,1.5,1.6,1.5,1.5,0.4,1.4
NYSE:BAX,Baxter International Inc.,Health Care,Health Care Equipment and Services,Health Care Equipment and Supplies,Health Care Equipment,69.5,16.1,42,8.3,0.011,"37,110.10","One Baxter Parkway, Deerfield, Illinois, 60015, United States",1.7,3.1,1.3,2.6,9,2.1,9,1.4,0.8,4.7
NYSE:BBT,BB&T Corporation,Financials,Banks,Banks,Regional Banks,48.9,0,13.2,2.3,0.033,"37,698.70","200 West Second Street, Winston-Salem, North Carolina, 27101, United States",3.4,4.1,2.7,3.4,2.8,3.1,2.8,3,2.7,3
NYSE:BDX,"Becton, Dickinson and Company",Health Care,Health Care Equipment and Services,Health Care Equipment and Supplies,Health Care Equipment,238.1,19.9,97.6,0,0.013,"63,704.20","1 Becton Drive, Franklin Lakes, New Jersey, 07417, United States",2.4,12.1,1.3,11,6,9.5,6,8.4,5.8,6.8
NYSE:BRK.B,Berkshire Hathaway Inc.,Financials,Diversified Financials,Diversified Financial Services,Multi-Sector Holdings,209.8,13.1,0,0,0,"521,060.40","3555 Farnam Street, Omaha, Nebraska, 68131, United States",28872.2,9.9,27325.5,7.9,14645.1,8.3,14645.1,7.9,12091.6,7.3
NYSE:BBY,"Best Buy Co., Inc.",Consumer Discretionary,Retailing,Specialty Retail,Computer and Electronics Retail,70.8,6.6,19.7,7.1,0.025,"19,435.90","7601 Penn Avenue South, Richfield, Minnesota, 55423, United States",3.6,5.3,4,4.2,3.3,3.4,3.3,2.8,2.9,2.6
NasdaqGS:BIIB,Biogen Inc.,Health Care,"Pharmaceuticals, Biotechnology and Life Sciences",Biotechnology,Biotechnology,320.4,10,22.8,18.8,0,"64,544.30","225 Binney Street, Cambridge, Massachusetts, 02142, United States",14.1,27,11.9,23.5,16.9,20.4,16.9,17.5,12.4,15.9
NYSE:BLK,"BlackRock, Inc.",Financials,Diversified Financials,Capital Markets,Asset Management and Custody Banks,401.7,10.2,11.5,41.7,0.031,"64,185.40","55 East 52nd Street, New York, New York, 10055, United States",33.2,28.3,30.2,24.4,19,21.2,19,20.1,19.3,19.7
NasdaqGS:BKNG,Booking Holdings Inc.,Consumer Discretionary,Retailing,Internet and Direct Marketing Retail,Internet and Direct Marketing Retail,1805.7,16,32.4,15.9,0,"85,722.10","800 Connecticut Avenue, Norwalk, Connecticut, 06854, United States",55.7,93.3,46.9,80.8,42.7,75.6,42.7,66,45.7,59.3
NYSE:BWA,BorgWarner Inc.,Consumer Discretionary,Automobiles and Components,Auto Components,Auto Parts and Equipment,36.7,5.3,14.4,4.7,0.019,"7,661.30","3850 Hamlin Road, Auburn Hills, Michigan, 48326, United States",2.5,4.5,2.1,4.1,0.6,3.4,0.6,3.2,2.9,3.6
NYSE:BXP,"Boston Properties, Inc.",Real Estate,Real Estate,Equity Real Estate Investment Trusts (REITs),Office REITs,117,20,34.4,3.2,0.032,"18,059.40","Prudential Center, 800 Boylston Street, Suite 1900, Boston, Massachusetts, 02199, United States",3.4,2.9,2.9,2.9,3.3,2.1,3.3,2,2.8,1.5
NYSE:BSX,Boston Scientific Corporation,Health Care,Health Care Equipment and Services,Health Care Equipment and Supplies,Health Care Equipment,36.5,22.1,96.5,0,0,"50,532.10","300 Boston Scientific Way, Marlborough, Massachusetts, 01752, United States",0.4,1.5,0.1,1.3,0.3,1.2,0.3,1,-0.1,0.9
NasdaqGS:BHF,"Brighthouse Financial, Inc.",Financials,Insurance,Insurance,Life and Health Insurance,42,0,0,0.4,0,"5,028.50","11225 North Community House Road, Charlotte, North Carolina, 28277, United States",-4.9,8.6,-3.2,8.6,-24.5,0,-24.5,0,0,0
NYSE:BMY,Bristol-Myers Squibb Company,Health Care,"Pharmaceuticals, Biotechnology and Life Sciences",Pharmaceuticals,Pharmaceuticals,54.3,14.9,241.7,19.5,0.029,"88,610.90","345 Park Avenue, New York, New York, 10154, United States",0.2,3.8,0.6,3.1,2.7,2.9,2.7,2.1,1.2,1.8
NasdaqGS:AVGO,Broadcom Inc.,Information Technology,Semiconductors and Semiconductor Equipment,Semiconductors and Semiconductor Equipment,Semiconductors,228.3,11.8,8.2,0,0.031,"94,381.60","1320 Ridder Park Drive, San Jose, California, 95131, United States",27.8,21.2,4,0,-4.6,0,-4.6,0,1.2,0
NYSE:BR,"Broadridge Financial Solutions, Inc.",Information Technology,Software and Services,IT Services,Data Processing and Outsourced Services,117,17.9,32.9,0,0.017,"13,605.40","5 Dakota Drive, Suite 300, Lake Success, New York, 11042, United States",3.6,4.7,3.1,3.7,2.4,3.2,2.4,2.8,2.1,2.5
NYSE:BF.B,Brown-Forman Corporation,Consumer Staples,"Food, Beverage and Tobacco",Beverages,Distillers and Vintners,48.1,22.7,31.6,0,0.013,"23,218.40","850 Dixie Highway, Louisville, Kentucky, 40210, United States",1.5,1.7,1.5,1.6,2.1,1.4,2.1,1.4,1.2,1.4
NasdaqGS:CHRW,"C.H. Robinson Worldwide, Inc.",Industrials,Transportation,Air Freight and Logistics,Air Freight and Logistics,90.9,15.1,22.4,103.2,0.02,"12,588.20","14701 Charlson Road, Eden Prairie, Minnesota, 55347, United States",4.1,4.7,3.6,3.6,3.6,3.6,3.6,3.7,3.1,3.3
NasdaqGS:CA,"CA, Inc.",Information Technology,Software and Services,Software,Systems Software,44,14.3,39.7,0,0.023,"18,382.60","520 Madison Avenue, 22nd Floor, New York, New York, 10022, United States",1.1,2.8,1,2.5,1.9,2.5,1.9,2.5,1.7,2.4
NYSE:COG,Cabot Oil & Gas Corporation,Energy,Energy,"Oil, Gas and Consumable Fuels",Oil and Gas Exploration and Production,24,14.5,82.8,4.9,0.01,"10,575.00","Three Memorial City Plaza, 840 Gessner Road, Suite 1400, Houston, Texas, 77024, United States",0.3,1.5,0.2,0.8,-0.9,0.3,-0.9,-0.1,0.3,0.9
NasdaqGS:CDNS,"Cadence Design Systems, Inc.",Information Technology,Software and Services,Software,Application Software,40.1,23.9,52,41.5,0,"11,343.40","2655 Seely Avenue, Building 5, San Jose, California, 95134, United States",0.8,1.7,0.7,1.5,0.7,1.3,0.7,1.1,0.4,1
NYSE:CPB,Campbell Soup Company,Consumer Staples,"Food, Beverage and Tobacco",Food Products,Packaged Foods and Meats,37.9,10.8,44.1,0,0.037,"11,403.90","1 Campbell Place, Camden, New Jersey, 08103, United States",0.9,2.4,2.9,3,2.1,3.1,2.1,2.8,2.5,2.5
NYSE:COF,Capital One Financial Corporation,Financials,Diversified Financials,Consumer Finance,Consumer Finance,91.6,0,13.8,1.4,0.017,"43,838.50","1680 Capital One Drive, McLean, Virginia, 22102, United States",6.6,11,3.8,8.6,6.9,7.9,6.9,7.7,7.6,7.7
NYSE:CAH,"Cardinal Health, Inc.",Health Care,Health Care Equipment and Services,Health Care Providers and Services,Health Care Distributors,53.2,7.7,65.7,0,0.036,"15,949.80","7000 Cardinal Place, Dublin, Ohio, 43017, United States",0.8,5,5.7,5.1,4.2,5.6,4.2,5.4,3.2,4.4
NYSE:KMX,"CarMax, Inc.",Consumer Discretionary,Retailing,Specialty Retail,Automotive Retail,68.7,19.7,17,3.5,0,"11,987.70","12800 Tuckahoe Creek Parkway, Richmond, Virginia, 23238, United States",4,4.8,3.7,4.1,3.2,3.5,3.2,3.3,2.5,2.8
NYSE:CCL,Carnival Corporation,Consumer Discretionary,Consumer Services,"Hotels, Restaurants and Leisure","Hotels, Resorts and Cruise Lines",57.2,9,12.8,2,0.035,"39,958.80","3655 NW 87th Avenue, Miami, Florida, 33178, United States",4.5,4.5,3.6,4.3,3.7,3.6,3.7,3.4,1.6,2.5
NYSE:CAT,Caterpillar Inc.,Industrials,Capital Goods,Machinery,Construction Machinery and Heavy Trucks,131.3,10.2,25.4,11.8,0.026,"78,046.80","510 Lake Cook Road, Suite 100, Deerfield, Illinois, 60015, United States",5.2,12.1,1.3,7.7,-0.1,3,-0.1,3.4,3.9,6.7
BATS:CBOE,"Cboe Global Markets, Inc.",Financials,Diversified Financials,Capital Markets,Financial Exchanges and Data,104.9,16.2,23,0,0.012,"11,730.90","400 South LaSalle Street, Chicago, Illinois, 60605, United States",4.6,4.5,3.7,3.8,2.3,2.4,2.3,2.5,2.2,2.5
NYSE:CBRE,"CBRE Group, Inc.",Real Estate,Real Estate,Real Estate Management and Development,Real Estate Services,39.6,9.3,18.6,0,0,"13,133.00","400 South Hope Street, 25th Floor, Los Angeles, California, 90071, United States",2.1,3.2,2,2.7,1.7,2.3,1.7,2.2,1.5,1.8
NYSE:CBS,CBS Corporation,Communication Services,Media and Entertainment,Media,Broadcasting,57.2,10.1,16.4,0,0.013,"21,518.80","51 West 52nd Street, New York, New York, 10019, United States",3.5,5.7,3.2,4.8,3.5,4.3,3.5,3.8,2.1,3.5
NasdaqGS:CELG,Celgene Corporation,Health Care,"Pharmaceuticals, Biotechnology and Life Sciences",Biotechnology,Biotechnology,82.4,15,22.9,0,0,"57,964.10","86 Morris Avenue, Summit, New Jersey, 07901, United States",3.6,9.6,3.6,8.3,2.5,6.8,2.5,5.4,2.4,4.4
NYSE:CNC,Centene Corporation,Health Care,Health Care Equipment and Services,Health Care Providers and Services,Managed Health Care,142.8,12.9,24.3,7.8,0,"29,306.50","Centene Plaza, 7700 Forsyth Boulevard, St. Louis, Missouri, 63105, United States",5.9,7.8,4.7,5.3,3.4,4.7,3.4,3.5,2.2,2.7
NYSE:CNP,"CenterPoint Energy, Inc.",Utilities,Utilities,Multi-Utilities,Multi-Utilities,28.1,8.7,7.8,3.2,0.039,"14,093.40","1111 Louisiana Street, Houston, Texas, 77002, United States",3.6,1.6,4.1,1.4,1,1.2,1,1.1,1.4,1.2
