constituents,companyName ,sector ,industryGroup ,industry ,subIndustry ,dividendAdjustedSplitAdjustedClosingStockPrice,bevEbitdaMultiples ,priceEarningsMultiples ,priceTangibleBook ,dividendYield ,marketCapitalization ,headquarterLocation ,actual2018,estimated2018,actual2017,estimated2017,actual2016,estimated2016,actual2015,estimated2015,actual2014,estimated2014
NYSE:MMM,3M Company,Industrials,Capital Goods,Industrial Conglomerates,Industrial Conglomerates,149.4,12.9,22.6,14.1,0.021,104514.1,"3M Center, St. Paul, Minnesota, 55144, United States",7.2,10.6,7.9,9.4,8.2,8.4,8.2,7.9,7.5,8.1
NYSE:AOS,A. O. Smith Corporation,Industrials,Capital Goods,Building Products,Building Products,27,14.2,26.2,8,0.011,5051.3,"11270 West Park Place, Milwaukee, Wisconsin, 53224, United States",1.9,2.8,1.7,2.3,1.9,2,1.9,1.7,1.1,1.3
NYSE:ABT,Abbott Laboratories,Health Care,Health Care Equipment and Services,Health Care Equipment and Supplies,Health Care Equipment,41.3,14.9,35.5,10,0.021,67790.7,"100 Abbott Park Road, Abbott Park, Illinois, 60064, United States",0.5,3,0.2,2.8,0.7,2.4,0.7,2.3,1.1,2.3
NYSE:ABBV,AbbVie Inc.,Health Care,"Pharmaceuticals, Biotechnology and Life Sciences",Biotechnology,Biotechnology,56.6,15.9,28.5,0,0.03,104275.5,"1 North Waukegan Road, North Chicago, Illinois, 60064, United States",4,8.2,3.3,6.2,3.6,5.2,3.6,4.8,1.1,3.9
NasdaqGS:ABMD,"ABIOMED, Inc.",Health Care,Health Care Equipment and Services,Health Care Equipment and Supplies,Health Care Equipment,38.1,98.9,158.4,11.1,0,1540,"22 Cherry Hill Drive, Danvers, Massachusetts, 01923, United States",3.6,3.8,2,2.3,1.1,1.5,1.1,0.8,0.4,0.3
NYSE:ACN,Accenture plc,Information Technology,Software and Services,IT Services,IT Consulting and Other Services,82.5,10.8,19.2,18.2,0.023,56098.2,"1 Grand Canal Square, Grand Canal Harbour, Dublin, Co. Dublin, 2, Ireland",6.2,7.2,5.6,6.7,6.8,5.9,6.8,5.4,4.7,4.8
NasdaqGS:ATVI,"Activision Blizzard, Inc.",Communication Services,Media and Entertainment,Entertainment,Interactive Home Entertainment,19.6,13.6,23.7,0,0.01,14488.5,"3100 Ocean Park Boulevard, Santa Monica, California, 90405, United States",0.7,2.9,0.4,2.4,1.3,2,1.3,1.5,1.1,1.3
NasdaqGS:ADBE,Adobe Inc.,Information Technology,Software and Services,Software,Application Software,72.7,46.8,145.4,23.1,0,36258.3,"345 Park Avenue, San Jose, California, 95110, United States",4.8,7.6,3.4,5.6,2.3,3.8,2.3,2.8,0.5,2.1
NYSE:AAP,"Advance Auto Parts, Inc.",Consumer Discretionary,Retailing,Specialty Retail,Automotive Retail,158.3,11.8,25.6,70.7,0.002,11626.5,"5008 Airport Road, Roanoke, Virginia, 24012, United States",7.2,7.5,6.4,5.7,6.2,7.6,6.2,8.9,6.2,8.5
NasdaqGS:AMD,"Advanced Micro Devices, Inc.",Information Technology,Semiconductors and Semiconductor Equipment,Semiconductors and Semiconductor Equipment,Semiconductors,2.7,7.1,40.7,0,0,2070.2,"2485 Augustine Drive, Santa Clara, California, 95054, United States",0.3,0.5,0,0.3,-0.6,0,-0.6,-0.4,-0.5,0.1
NYSE:AET,Aetna Inc.,Health Care,Health Care Equipment and Services,Health Care Providers and Services,Managed Health Care,85.4,7.9,14.8,11.6,0.011,31241.5,"151 Farmington Avenue, Hartford, Connecticut, 06156, United States",10.6,11.5,5.7,9.3,6.4,8.4,6.4,7.8,5.7,6.9
NYSE:AMG,"Affiliated Managers Group, Inc.",Financials,Diversified Financials,Capital Markets,Asset Management and Custody Banks,210.1,11.3,27.3,0,0,11794.8,"777 South Flagler Drive, West Palm Beach, Florida, 33401, United States",12.7,15.7,12,15.8,8.6,14,8.6,13.3,7.7,12.5
NYSE:AFL,Aflac Incorporated,Financials,Insurance,Insurance,Life and Health Insurance,27.9,7.8,9.6,1.5,0.026,27526.4,"1932 Wynnton Road, Columbus, Georgia, 31999, United States",6.2,4,5.8,3.4,3.2,3.3,3.2,3.1,3.3,3
NYSE:A,"Agilent Technologies, Inc.",Health Care,"Pharmaceuticals, Biotechnology and Life Sciences",Life Sciences Tools and Services,Life Sciences Tools and Services,39.3,10.6,27.5,7.9,0.01,13728.1,"5301 Stevens Creek Boulevard, Santa Clara, California, 95051, United States",0.9,2.9,2.1,2.6,1.4,2.2,1.4,1.9,0.7,1.7
NYSE:APD,"Air Products and Chemicals, Inc.",Materials,Materials,Chemicals,Industrial Gases,121.3,13.5,31.4,5.6,0.021,30868.4,"7201 Hamilton Boulevard, Allentown, Pennsylvania, 18195, United States",6.7,8,4.7,7,4.9,6.4,4.9,7.4,4.8,6.5
NasdaqGS:AKAM,"Akamai Technologies, Inc.",Information Technology,Software and Services,IT Services,Internet Services and Infrastructure,63,17,36,6.8,0,11206.5,"150 Broadway, Cambridge, Massachusetts, 02142, United States",1.1,3.6,1.3,2.6,1.8,2.8,1.8,2.6,1.8,2.6
NYSE:ALK,"Alaska Air Group, Inc.",Industrials,Transportation,Airlines,Airlines,56.4,6.6,15.5,3.6,0.008,7926.1,"19300 International Boulevard, Seattle, Washington, 98188, United States",6.8,4.9,8.4,5.9,6.5,7.1,6.5,7.1,4.4,5.1
NYSE:ALB,Albemarle Corporation,Materials,Materials,Chemicals,Specialty Chemicals,56.6,7.1,12.6,4.1,0.018,4705.1,"4350 Congress Street, Suite 700, Charlotte, North Carolina, 28209, United States",3,5.8,0.5,5,3.9,3.7,3.9,3.8,2.6,4.4
NYSE:ARE,"Alexandria Real Estate Equities, Inc.",Real Estate,Real Estate,Equity Real Estate Investment Trusts (REITs),Office REITs,79,23.4,50.4,1.8,0.033,6390,"385 East Colorado Boulevard, Suite 299, Pasadena, California, 91101, United States",2.8,2.4,1.6,1.9,-2,1.8,-2,1.9,1,1.7
NasdaqGS:ALXN,"Alexion Pharmaceuticals, Inc.",Health Care,"Pharmaceuticals, Biotechnology and Life Sciences",Biotechnology,Biotechnology,185,39.9,77,16.2,0,36689,"121 Seaport Boulevard, Boston, Massachusetts, 02210, United States",-0.5,7.6,2,6.4,1.8,5.4,1.8,5,3.3,5.5
NasdaqGS:ALGN,"Align Technology, Inc.",Health Care,Health Care Equipment and Services,Health Care Equipment and Supplies,Health Care Supplies,55.9,19.1,30.9,7,0,4489,"2820 Orchard Parkway, San Jose, California, 95134, United States",3.6,5.4,2.8,4.1,2.3,2.8,2.3,2.1,1.8,2
NYSE:ALLE,Allegion plc,Industrials,Capital Goods,Building Products,Building Products,53.9,16,34.1,0,0.006,5309.1,"Iveagh Court, Block D, Harcourt Road, Dublin, Co. Dublin, 2, Ireland",3,4.7,2.9,4.1,2.4,3.6,2.4,3.3,1.9,2.9
NYSE:AGN,Allergan plc,Health Care,"Pharmaceuticals, Biotechnology and Life Sciences",Pharmaceuticals,Pharmaceuticals,250.8,23,0,0,0,68266.3,"Clonshaugh Business and Technology Park, Coolock, Dublin, Co. Dublin, D17 E400, Ireland",-4.1,16.2,-12,16.5,-3.2,15.4,-3.2,15.5,-11.3,15.8
NYSE:ADS,Alliance Data Systems Corporation,Information Technology,Software and Services,IT Services,Data Processing and Outsourced Services,280.7,23.2,32.7,0,0,18312.9,"7500 Dallas Parkway, Suite 700, Plano, Texas, 75024, United States",15.9,24.6,14.1,20.6,7.3,18.2,7.3,16.7,7.9,14.2
NYSE:LNT,Alliant Energy Corporation,Utilities,Utilities,Electric Utilities,Electric Utilities,29.3,10.8,18.8,2.1,0.031,7368.3,"4902 North Biltmore Lane, Madison, Wisconsin, 53718, United States",2.1,2.1,2,2.3,1.6,2.1,1.6,1.9,1.7,1.8
NasdaqGS:GOOG,Alphabet Inc.,Communication Services,Media and Entertainment,Interactive Media and Services,Interactive Media and Services,525,15.4,0,0,0,358536.7,"1600 Amphitheatre Parkway, Mountain View, California, 94043, United States",23.2,44.8,18,39.6,27.9,39.4,27.9,32.4,19.8,28.8
NasdaqGS:GOOG.L,Alphabet Inc.,Communication Services,Media and Entertainment,Interactive Media and Services,Interactive Media and Services,530.7,15.4,28.2,4.6,0,358536.7,"1600 Amphitheatre Parkway, Mountain View, California, 94043, United States",23.2,43.8,18,39.6,27.9,39.4,27.9,32.4,19.8,28.9
NYSE:MO,"Altria Group, Inc.",Consumer Staples,"Food, Beverage and Tobacco",Tobacco,Tobacco,42.5,11.3,22.7,0,0.042,97380.7,"6601 West Broad Street, Richmond, Virginia, 23230, United States",5.6,4.2,5.3,3.5,7.3,3.2,7.3,3,2.6,2.8
NasdaqGS:AMZN,"Amazon.com, Inc.",Consumer Discretionary,Retailing,Internet and Direct Marketing Retail,Internet and Direct Marketing Retail,310.4,37.5,0,20.5,0,143693.9,"410 Terry Avenue North, Seattle, Washington, 98109, United States",12.6,20.1,6.2,6.1,4.9,7.2,4.9,4.4,-0.5,0.1
NYSE:AEE,Ameren Corporation,Utilities,Utilities,Multi-Utilities,Multi-Utilities,40.5,8.6,19.2,1.8,0.036,11192.8,"1901 Chouteau Avenue, MC 1370, St. Louis, Missouri, 63103, United States",2.5,3.3,2.1,2.8,2.7,2.7,2.7,2.3,2.4,2.5
NasdaqGS:AAL,American Airlines Group Inc.,Industrials,Transportation,Airlines,Airlines,51.8,8.4,104.7,0,0.007,38466.8,"4333 Amon Carter Boulevard, Fort Worth, Texas, 76155, United States",3.1,4.5,3.9,4.8,4.8,4.5,4.8,7.1,3.9,8.4
NYSE:AEP,"American Electric Power Company, Inc.",Utilities,Utilities,Electric Utilities,Electric Utilities,53.1,8.9,16.6,1.8,0.035,29706.7,"1 Riverside Plaza, Columbus, Ohio, 43215, United States",3.9,4,3.9,3.8,1.2,3.6,1.2,3.6,3.2,3.3
NYSE:AXP,American Express Company,Financials,Diversified Financials,Consumer Finance,Consumer Finance,87.3,0,17.3,4.8,0.011,96266.3,"200 Vesey Street, lower Manhattan, New York, New York, 10285, United States",3.8,7.5,3,6.3,5.7,5.2,5.7,5.2,5.6,5.9
NYSE:AIG,"American International Group, Inc.",Financials,Insurance,Insurance,Multi-line Insurance,52,7,9.3,0.7,0.009,78409.1,"175 Water Street, New York, New York, 10038, United States",-7.2,5.1,-6.5,4.7,-0.7,5.1,-0.7,4.9,5.2,4.8
NYSE:AMT,American Tower Corporation (REIT),Real Estate,Real Estate,Equity Real Estate Investment Trusts (REITs),Specialized REITs,91.6,21.2,54,0,0.015,39190.4,"116 Huntington Avenue, 11th Floor, Boston, Massachusetts, 02116, United States",2.5,3.5,2.7,3.4,2,2.6,2,2.3,2,2.6
NYSE:AWK,"American Water Works Company, Inc.",Utilities,Utilities,Water Utilities,Water Utilities,49.2,10.9,24.2,2.6,0.023,9557.2,"1025 Laurel Oak Road, Voorhees, New Jersey, 08043, United States",2.6,3.3,2.4,3.2,2.6,2.9,2.6,2.8,2.4,2.6
NYSE:AMP,"Ameriprise Financial, Inc.",Financials,Diversified Financials,Capital Markets,Asset Management and Custody Banks,120.2,8.3,17.5,3,0.018,24404.4,"55 Ameriprise Financial Center, Minneapolis, Minnesota, 55474, United States",11.4,15.5,9.4,12.7,7.8,10.1,7.8,10,8.3,9.3
NYSE:ABC,AmerisourceBergen Corporation,Health Care,Health Care Equipment and Services,Health Care Providers and Services,Health Care Distributors,85,14.5,74.5,0,0.013,19717.3,"1300 Morris Drive, Chesterbrook, Pennsylvania, 19087, United States",4.9,6.9,4.4,6.1,6,5.8,6,5.8,0.2,4.5
NYSE:AME,"AMETEK, Inc.",Industrials,Capital Goods,Electrical Equipment,Electrical Components and Equipment,51.3,14,22.9,0,0.007,12943.5,"1100 Cassatt Road, Berwyn, Pennsylvania, 19312, United States",3.3,3.4,2.9,2.8,2.2,2.4,2.2,2.7,2.4,2.6
NasdaqGS:AMGN,Amgen Inc.,Health Care,"Pharmaceuticals, Biotechnology and Life Sciences",Biotechnology,Biotechnology,144.8,14.9,25.1,0,0.02,121167.1,"One Amgen Center Drive, Thousand Oaks, California, 91320, United States",3.3,14,2.7,12.5,10.2,11.9,10.2,10.2,6.7,8.9
NYSE:APH,Amphenol Corporation,Information Technology,Technology Hardware and Equipment,"Electronic Equipment, Instruments and Components",Electronic Components,52,15.6,25.4,151,0.009,16652.3,"358 Hall Avenue, PO Box 5030, Wallingford, Connecticut, 06492, United States",2.3,3.8,2.1,3.3,2.6,2.9,2.6,2.5,2.2,2.4
NYSE:APC,Anadarko Petroleum Corporation,Energy,Energy,"Oil, Gas and Consumable Fuels",Oil and Gas Exploration and Production,79.7,5.4,0,2.8,0.013,41782.1,"1201 Lake Robbins Drive, The Woodlands, Texas, 77380, United States",0.8,4,-0.9,-0.4,-5.9,-0.6,-5.9,-2.7,-3.5,2.9
NasdaqGS:ADI,"Analog Devices, Inc.",Information Technology,Semiconductors and Semiconductor Equipment,Semiconductors and Semiconductor Equipment,Semiconductors,50.7,15,28,7.1,0.027,17278.1,"One Technology Way, PO Box 9106, Norwood, Massachusetts, 02062, United States",3.8,5.8,2.1,5.2,2.8,3.4,2.8,3.3,2,2.8
NasdaqGS:ANSS,"ANSYS, Inc.",Information Technology,Software and Services,Software,Application Software,82,15.7,29.7,11.3,0,7536.5,"2600 ANSYS Drive, Canonsburg, Pennsylvania, 15317, United States",3.5,5.2,3,4.1,3,3.7,3,3.5,2.7,3.4
NYSE:ANTM,"Anthem, Inc.",Health Care,Health Care Equipment and Services,Health Care Providers and Services,Managed Health Care,118.3,9.5,15.5,0,0.014,33923.5,"120 Monument Circle, Indianapolis, Indiana, 46204, United States",16.4,16.5,14.4,12.2,9.2,11.4,9.2,10.5,9,9.3
NYSE:AON,Aon plc,Financials,Insurance,Insurance,Insurance Brokers,90.5,13.2,22.3,0,0.011,27039.5,"The Leadenhall Building, The Aon Centre, 122 Leadenhall Street, London, Greater London, EC3V 4AN, United Kingdom",3.3,8.6,1.5,7.5,4.5,6.8,4.5,6.2,4.7,5.8
NYSE:APA,Apache Corporation,Energy,Energy,"Oil, Gas and Consumable Fuels",Oil and Gas Exploration and Production,57.8,3.4,0,0.8,0.016,23594.1,"One Post Oak Central, Suite 100, 2000 Post Oak Boulevard, Houston, Texas, 77056, United States",2.2,2,3.4,0.9,-3.6,1.2,-3.6,-0.8,-17.3,2
NYSE:AIV,Apartment Investment and Management Company,Real Estate,Real Estate,Equity Real Estate Investment Trusts (REITs),Residential REITs,32.8,17.8,20.5,5.2,0.028,5431.5,"4582 South Ulster Street, Suite 1100, Denver, Colorado, 80237, United States",2.3,0.3,2,0.7,2.7,0.3,2.7,0.5,2.1,0.4
NasdaqGS:AAPL,Apple Inc.,Information Technology,Technology Hardware and Equipment,"Technology Hardware, Storage and Peripherals","Technology Hardware, Storage and Peripherals",103.3,10.9,17.1,6.3,0.017,647361,"1 Infinite Loop, Cupertino, California, 95014, United States",11,13.4,9.7,11.5,8.3,9,8.3,9.8,7.4,7.8
NasdaqGS:AMAT,"Applied Materials, Inc.",Information Technology,Semiconductors and Semiconductor Equipment,Semiconductors and Semiconductor Equipment,Semiconductor Equipment,23.5,15.6,28.6,8.4,0.016,30439.1,"3050 Bowers Avenue, PO Box 58039, Santa Clara, California, 95052, United States",3.3,4,3.2,4,1.5,2.4,1.5,1.2,0.9,1.3
NYSE:APTV,Aptiv PLC,Consumer Discretionary,Automobiles and Components,Auto Components,Auto Parts and Equipment,57.7,9.1,17,11.9,0.014,21530.9,"C, Ardilaun Court, 112-114 St. Stephen's Green, Dublin, Co. Dublin, 2, Ireland",4.1,5.5,3.7,5.1,2.9,6.3,2.9,6,4.3,5.5
NYSE:ADM,Archer-Daniels-Midland Company,Consumer Staples,"Food, Beverage and Tobacco",Food Products,Agricultural Products,46.7,8.5,17.9,1.7,0.018,33477,"77 West Wacker Drive, Suite 4600, Chicago, Illinois, 60601, United States",3.4,3.6,2.8,2.6,2.2,2.9,2.2,2.9,3.4,3.5
NYSE:ARNC,Arconic Inc.,Industrials,Capital Goods,Aerospace and Defense,Aerospace and Defense,0,0,0,0,0,0,"390 Park Avenue, New York, New York, 10022, United States",-0.8,1.4,-0.3,1.4,-2.6,1.2,-2.6,0,-0.2,0
NYSE:ANET,"Arista Networks, Inc.",Information Technology,Technology Hardware and Equipment,Communications Equipment,Communications Equipment,60.8,29.8,62.7,7.9,0,3914.5,"5453 Great America Parkway, Santa Clara, California, 95054, United States",2.9,7.8,5.3,5.9,2.5,3.3,2.5,2.5,1.3,1.5
NYSE:AJG,Arthur J. Gallagher & Co.,Financials,Insurance,Insurance,Insurance Brokers,42.2,14.9,22.1,0,0.031,7597.5,"2850 Golf Road, Rolling Meadows, Illinois, 60008, United States",3,3.7,2.5,3.3,2.3,3,2.3,2.7,2,2.6
NYSE:AIZ,"Assurant, Inc.",Financials,Insurance,Insurance,Multi-line Insurance,63,4.6,9.5,1.2,0.016,4807.6,"28 Liberty Street, 41st Floor, New York, New York, 10005, United States",7.7,7.9,9.4,6.7,9.1,5,9.1,6.4,6.4,6.5
NYSE:T,AT&T Inc.,Communication Services,Telecommunication Services,Diversified Telecommunication Services,Integrated Telecommunication Services,27.2,5.4,10.3,0,0.056,174231.3,"208 South Akard Street, Dallas, Texas, 75202, United States",5.1,3.6,4.8,2.9,2.1,2.9,2.1,2.8,1.2,2.5
NasdaqGS:ADSK,"Autodesk, Inc.",Information Technology,Software and Services,Software,Application Software,60.1,40.2,113.2,22.8,0,13664.9,"111 McInnis Parkway, San Rafael, California, 94903, United States",-1.9,2,-2.6,0.7,-2,-0.5,-2,-0.3,0.5,1.3
NasdaqGS:ADP,"Automatic Data Processing, Inc.",Information Technology,Software and Services,IT Services,Data Processing and Outsourced Services,76.5,15.2,26.2,11.6,0.024,40189.1,"One ADP Boulevard, Roseland, New Jersey, 07068, United States",3.7,5.2,3.9,4,3.7,3.7,3.7,3.3,2.7,3
NYSE:AZO,"AutoZone, Inc.",Consumer Discretionary,Retailing,Specialty Retail,Automotive Retail,619.1,11.4,19,0,0,19748.4,"123 South Front Street, Memphis, Tennessee, 38103, United States",49.2,57.5,44.8,47.8,41.8,46.6,41.8,41.8,32.6,36.8
NYSE:AVB,"AvalonBay Communities, Inc.",Real Estate,Real Estate,Equity Real Estate Investment Trusts (REITs),Residential REITs,145.4,23.4,36.1,2.4,0.028,21568.8,"Ballston Tower, Suite 800, 671 North Glebe Road, Arlington, Virginia, 22203, United States",6.3,4.8,6.4,4.7,7.5,4.5,7.5,4.3,4.9,3.7
NYSE:AVY,Avery Dennison Corporation,Materials,Materials,Containers and Packaging,Paper Packaging,47.9,8.4,22.3,9.8,0.027,4726.3,"207 Goode Avenue, Glendale, California, 91203, United States",3,6.3,3.1,5.5,3.5,4.3,3.5,3.6,2.3,3.3
NYSE:BHGE,"Baker Hughes, a GE company",Energy,Energy,Energy Equipment and Services,Oil and Gas Equipment and Services,36.9,0,0,0,0,24260.5,"17021 Aldine Westfield Road, Houston, Texas, 77073, United States",-0.1,1.1,-0.2,0.8,0,0,0,0,0,0
NYSE:BLL,Ball Corporation,Materials,Materials,Containers and Packaging,Metal and Glass Containers,33,10.3,18.9,0,0.008,9334,"10 Longs Peak Drive, PO Box 5000, Broomfield, Colorado, 80021, United States",1.3,2.4,1.1,2.2,0.8,2,0.8,1.8,1.7,2
NYSE:BAC,Bank of America Corporation,Financials,Banks,Banks,Diversified Banks,16.9,0,44.7,1.3,0.011,188139.3,"Bank of America Corporate Center, 100 North Tryon Street, Charlotte, North Carolina, 28255, United States",1.9,2.8,1.6,2.1,1.5,1.6,1.5,1.5,0.4,1.4
NYSE:BAX,Baxter International Inc.,Health Care,Health Care Equipment and Services,Health Care Equipment and Supplies,Health Care Equipment,37.8,11.1,21.9,18,0.028,39721.6,"One Baxter Parkway, Deerfield, Illinois, 60015, United States",1.7,3.1,1.3,2.6,9,2.1,9,1.4,0.8,4.7
NYSE:BBT,BB&T Corporation,Financials,Banks,Banks,Regional Banks,34.9,0,14.2,2,0.025,28016.2,"200 West Second Street, Winston-Salem, North Carolina, 27101, United States",3.4,4.1,2.7,3.4,2.8,3.1,2.8,3,2.7,3
NYSE:BDX,"Becton, Dickinson and Company",Health Care,Health Care Equipment and Services,Health Care Equipment and Supplies,Health Care Equipment,131.3,13,23.2,9.4,0.017,26911,"1 Becton Drive, Franklin Lakes, New Jersey, 07417, United States",2.4,12.1,1.3,11,6,9.5,6,8.4,5.8,6.8
NYSE:BRK.B,Berkshire Hathaway Inc.,Financials,Diversified Financials,Diversified Financial Services,Multi-Sector Holdings,150.2,9.9,0,0,0,370652.6,"3555 Farnam Street, Omaha, Nebraska, 68131, United States",28872.2,9.9,27325.5,7.9,14645.1,8.3,14645.1,7.9,12091.6,7.3
NYSE:BBY,"Best Buy Co., Inc.",Consumer Discretionary,Retailing,Specialty Retail,Computer and Electronics Retail,34.4,7,13.4,3.4,0.019,13672.6,"7601 Penn Avenue South, Richfield, Minnesota, 55423, United States",3.6,5.3,4,4.2,3.3,3.4,3.3,2.8,2.9,2.6
NasdaqGS:BIIB,Biogen Inc.,Health Care,"Pharmaceuticals, Biotechnology and Life Sciences",Biotechnology,Biotechnology,312.7,19.3,32.1,16.9,0,80162.8,"225 Binney Street, Cambridge, Massachusetts, 02142, United States",14.1,27,11.9,23.5,16.9,20.4,16.9,17.5,12.4,15.9
NYSE:BLK,"BlackRock, Inc.",Financials,Diversified Financials,Capital Markets,Asset Management and Custody Banks,326.4,12.9,18.5,0,0.022,59837.3,"55 East 52nd Street, New York, New York, 10055, United States",33.2,28.3,30.2,24.4,19,21.2,19,20.1,19.3,19.7
NasdaqGS:BKNG,Booking Holdings Inc.,Consumer Discretionary,Retailing,Internet and Direct Marketing Retail,Internet and Direct Marketing Retail,"1,140.20",18,25.8,19.4,0,59696.8,"800 Connecticut Avenue, Norwalk, Connecticut, 06854, United States",55.7,93.3,46.9,80.8,42.7,75.6,42.7,66,45.7,59.3
NYSE:BWA,BorgWarner Inc.,Consumer Discretionary,Automobiles and Components,Auto Components,Auto Parts and Equipment,52.3,9.1,19.2,5,0.009,12494.2,"3850 Hamlin Road, Auburn Hills, Michigan, 48326, United States",2.5,4.5,2.1,4.1,0.6,3.4,0.6,3.2,2.9,3.6
NYSE:BXP,"Boston Properties, Inc.",Real Estate,Real Estate,Equity Real Estate Investment Trusts (REITs),Office REITs,116.8,21,60.4,3.6,0.02,19702.4,"Prudential Center, 800 Boylston Street, Suite 1900, Boston, Massachusetts, 02199, United States",3.4,2.9,2.9,2.9,3.3,2.1,3.3,2,2.8,1.5
NYSE:BSX,Boston Scientific Corporation,Health Care,Health Care Equipment and Services,Health Care Equipment and Supplies,Health Care Equipment,13.3,13.2,62.8,0,0,17576,"300 Boston Scientific Way, Marlborough, Massachusetts, 01752, United States",0.4,1.5,0.1,1.3,0.3,1.2,0.3,1,-0.1,0.9
NasdaqGS:BHF,"Brighthouse Financial, Inc.",Financials,Insurance,Insurance,Life and Health Insurance,0,0,0,0,0,0,"11225 North Community House Road, Charlotte, North Carolina, 28277, United States",-4.9,8.6,-3.2,8.6,-24.5,0,-24.5,0,0,0
NYSE:BMY,Bristol-Myers Squibb Company,Health Care,"Pharmaceuticals, Biotechnology and Life Sciences",Pharmaceuticals,Pharmaceuticals,53.7,22.3,36.4,15.3,0.025,97917.6,"345 Park Avenue, New York, New York, 10154, United States",0.2,3.8,0.6,3.1,2.7,2.9,2.7,2.1,1.2,1.8
NasdaqGS:AVGO,Broadcom Inc.,Information Technology,Semiconductors and Semiconductor Equipment,Semiconductors and Semiconductor Equipment,Semiconductors,94,19.6,86.7,0,0.014,25683.8,"1320 Ridder Park Drive, San Jose, California, 95131, United States",27.8,21.2,4,0,-4.6,0,-4.6,0,1.2,0
NYSE:BR,"Broadridge Financial Solutions, Inc.",Information Technology,Software and Services,IT Services,Data Processing and Outsourced Services,43.1,11.4,22.9,0,0.023,5542.3,"5 Dakota Drive, Suite 300, Lake Success, New York, 11042, United States",3.6,4.7,3.1,3.7,2.4,3.2,2.4,2.8,2.1,2.5
NYSE:BF.B,Brown-Forman Corporation,Consumer Staples,"Food, Beverage and Tobacco",Beverages,Distillers and Vintners,32.8,19.2,28.2,22.9,0.014,18564.9,"850 Dixie Highway, Louisville, Kentucky, 40210, United States",1.5,1.7,1.5,1.6,2.1,1.4,2.1,1.4,1.2,1.4
NasdaqGS:CHRW,"C.H. Robinson Worldwide, Inc.",Industrials,Transportation,Air Freight and Logistics,Air Freight and Logistics,68.6,15.2,25.9,122.7,0.02,10944,"14701 Charlson Road, Eden Prairie, Minnesota, 55347, United States",4.1,4.7,3.6,3.6,3.6,3.6,3.6,3.7,3.1,3.3
NasdaqGS:CA,"CA, Inc.",Information Technology,Software and Services,Software,Systems Software,27,8.8,17.3,0,0.033,13547.4,"520 Madison Avenue, 22nd Floor, New York, New York, 10022, United States",1.1,2.8,1,2.5,1.9,2.5,1.9,2.5,1.7,2.4
NYSE:COG,Cabot Oil & Gas Corporation,Energy,Energy,"Oil, Gas and Consumable Fuels",Oil and Gas Exploration and Production,29,9.7,30.9,5.2,0.003,12229.5,"Three Memorial City Plaza, 840 Gessner Road, Suite 1400, Houston, Texas, 77024, United States",0.3,1.5,0.2,0.8,-0.9,0.3,-0.9,-0.1,0.3,0.9
NasdaqGS:CDNS,"Cadence Design Systems, Inc.",Information Technology,Software and Services,Software,Application Software,19,17.4,43.2,15.9,0,5552.9,"2655 Seely Avenue, Building 5, San Jose, California, 95134, United States",0.8,1.7,0.7,1.5,0.7,1.3,0.7,1.1,0.4,1
NYSE:CPB,Campbell Soup Company,Consumer Staples,"Food, Beverage and Tobacco",Food Products,Packaged Foods and Meats,39.5,11.2,17.6,0,0.028,13787.1,"1 Campbell Place, Camden, New Jersey, 08103, United States",0.9,2.4,2.9,3,2.1,3.1,2.1,2.8,2.5,2.5
NYSE:COF,Capital One Financial Corporation,Financials,Diversified Financials,Consumer Finance,Consumer Finance,76.7,0,11.1,1.7,0.015,46336.9,"1680 Capital One Drive, McLean, Virginia, 22102, United States",6.6,11,3.8,8.6,6.9,7.9,6.9,7.7,7.6,7.7
NYSE:CAH,"Cardinal Health, Inc.",Health Care,Health Care Equipment and Services,Health Care Providers and Services,Health Care Distributors,73.6,11.8,25.5,81,0.017,26718.6,"7000 Cardinal Place, Dublin, Ohio, 43017, United States",0.8,5,5.7,5.1,4.2,5.6,4.2,5.4,3.2,4.4
NYSE:KMX,"CarMax, Inc.",Consumer Discretionary,Retailing,Specialty Retail,Automotive Retail,66.6,22.2,26.8,4.4,0,14042.9,"12800 Tuckahoe Creek Parkway, Richmond, Virginia, 23238, United States",4,4.8,3.7,4.1,3.2,3.5,3.2,3.3,2.5,2.8
NYSE:CCL,Carnival Corporation,Consumer Discretionary,Consumer Services,"Hotels, Restaurants and Leisure","Hotels, Resorts and Cruise Lines",41.1,13.9,28.5,1.8,0.022,35223.8,"3655 NW 87th Avenue, Miami, Florida, 33178, United States",4.5,4.5,3.6,4.3,3.7,3.6,3.7,3.4,1.6,2.5
NYSE:CAT,Caterpillar Inc.,Industrials,Capital Goods,Machinery,Construction Machinery and Heavy Trucks,80.4,9.6,14.8,6.3,0.031,55412.2,"510 Lake Cook Road, Suite 100, Deerfield, Illinois, 60015, United States",5.2,12.1,1.3,7.7,-0.1,3,-0.1,3.4,3.9,6.7
BATS:CBOE,"Cboe Global Markets, Inc.",Financials,Diversified Financials,Capital Markets,Financial Exchanges and Data,60.5,15.4,29.6,28.1,0.013,5352.6,"400 South LaSalle Street, Chicago, Illinois, 60605, United States",4.6,4.5,3.7,3.8,2.3,2.4,2.3,2.5,2.2,2.5
NYSE:CBRE,"CBRE Group, Inc.",Real Estate,Real Estate,Real Estate Management and Development,Real Estate Services,34.3,12.2,29.2,0,0,11146.2,"400 South Hope Street, 25th Floor, Los Angeles, California, 90071, United States",2.1,3.2,2,2.7,1.7,2.3,1.7,2.2,1.5,1.8
NYSE:CBS,CBS Corporation,Communication Services,Media and Entertainment,Media,Broadcasting,52.9,9.8,21.4,0,0.011,28714.6,"51 West 52nd Street, New York, New York, 10019, United States",3.5,5.7,3.2,4.8,3.5,4.3,3.5,3.8,2.1,3.5
NasdaqGS:CELG,Celgene Corporation,Health Care,"Pharmaceuticals, Biotechnology and Life Sciences",Biotechnology,Biotechnology,111.9,33,58.6,0,0,89343,"86 Morris Avenue, Summit, New Jersey, 07901, United States",3.6,9.6,3.6,8.3,2.5,6.8,2.5,5.4,2.4,4.4
NYSE:CNC,Centene Corporation,Health Care,Health Care Equipment and Services,Health Care Providers and Services,Managed Health Care,51.9,12.3,29.3,8.1,0,6092.8,"Centene Plaza, 7700 Forsyth Boulevard, St. Louis, Missouri, 63105, United States",5.9,7.8,4.7,5.3,3.4,4.7,3.4,3.5,2.2,2.7
NYSE:CNP,"CenterPoint Energy, Inc.",Utilities,Utilities,Multi-Utilities,Multi-Utilities,19.8,7.9,18.5,2.8,0.041,10070.1,"1111 Louisiana Street, Houston, Texas, 77002, United States",3.6,1.6,4.1,1.4,1,1.2,1,1.1,1.4,1.2
NYSE:CTL,"CenturyLink, Inc.",Communication Services,Telecommunication Services,Diversified Telecommunication Services,Alternative Carriers,28.1,6,27.7,0,0.055,22588.5,"100 CenturyLink Drive, Monroe, Louisiana, 71203, United States",1.8,1.2,2.2,1.4,1.2,2.3,1.2,2.4,1.4,2.5
